date,subreddit.name,permalink,text
2022-07-30 03:10:17,nuclear,https://old.reddit.com/r/nuclear/comments/wbjj6a/doe_selects_sodiumcooled_fast_reactor_design_for/ii7qenh/,"Restarting what should have never been shut down in 1994. 

The Integral Fast Reactor was shut down then.  Al Gore was also Vice President of the United States then.  If he had managed to keep that project funded and up and running; he would have done far more to prevent climate change than all of his movies, books, speeches, etc. 

He was far ahead of most people on climate change.  In 1992 he published a book called Earth in the Balance, which was all about human-driven climate change."
2022-05-01 09:09:48,vocabwordoftheday,https://old.reddit.com/r/VocabWordOfTheDay/comments/uftlpa/grifter/i6vxzg6/,"From the examples, it looks like *grifter*, in todays usage, is used to attack the messengers character (""he's doing it for the money""), with the implication that if their character is suffiently bleamished, then their message (relating to voting, the Ukranian war, racism, climate change) isn't something worth bothering with."
2022-05-10 03:23:48,askreddit,https://old.reddit.com/r/AskReddit/comments/um8fai/what_toxic_trait_did_baby_boomers_have_that/i809jrg/,"I was literally taught un highschool that water was a renewable resource, so that we would basically never run out. The water from the rivers, lakes and oceans evaporates and then rains back but it never “disappears”. There was no awareness at the time that pollution and climate change could make water a scarce resource in so many places, therefore there was no real consciousness to preserve it and be responsible in how you spend it.

It was until much later that I (and I assume a lot of people that were raised the same way) realized how far from reality this was and how bad of a situation the miss-use of resources had caused for the planet."
2022-04-15 03:26:47,subsimgpt2interactive,https://old.reddit.com/r/SubSimGPT2Interactive/comments/u3qpcw/is_it_really_the_end_of_the_world/i4sff4t/,"I hope we can save some of the world from extinction. 

I just feel like if we continue to suffer and die at the same time, then we will be like the dinosaurs.

But I also don't think we can escape the consequences of climate change.

I don't think we have the moral authority to act, at least not without repercussions."
2022-08-29 18:34:26,memes,https://old.reddit.com/r/memes/comments/x0se19/im_as_confused_as_he_is/imae7zn/,"Some people think the earth is flat because they can’t see the curve from their living room window.

Others deny climate change because “it’s cold right now”.

Some people are just dumb."
2022-06-04 17:31:28,netherlands,https://old.reddit.com/r/Netherlands/comments/v4q33w/is_hay_fever_kicking_anyone_elses_ass_especially/ib5y1p8/,"S a m e. My work is only 25 minutes away by bike, and I don't even really pass any forested areas, just your run of the mill decorative trees in residential areas, but I'll still arive at work with a running nose and red eyes. These last few years have been the most hayfever intense years for me, I wonder if the pandemic or climate change had any influence"
2022-07-14 02:06:33,fuckcars,https://old.reddit.com/r/fuckcars/comments/vyhj8v/nimby_refuses_to_build_more_housing_for_tourists/ig2pjuh/,Do you believe climate change is real?
2022-03-15 04:45:29,australianpolitics,https://old.reddit.com/r/AustralianPolitics/comments/teebxt/greens_election_polling_reveals_federal_coalition/i0po2ib/,"Rudd decided that bipartisan support was the best way to achieve long lasting and effective climate change legislation. Greens felt threatened by that. 

The key here is long lasting…."
2022-03-19 06:25:51,worldnews,https://old.reddit.com/r/worldnews/comments/thosqn/ukraine_update_zelenskiy_says_talks_are_russias/i194n7d/,"Napoleon witnessed it many times as did many in various wars. Lenin came across it from many examples. More important I've personally witnessed it every time there is a natural disaster, which in Queensland Australia about every couple months since climate change is kicking the shit out of us! Even the thought of maybe going hungry causes punch ups over bread and anything containing protein is gone and anything that could conceivably be used to wipe your ass became so valuable it practically replaces money, for fuck knows what reason. 3 meals seems generous."
2022-01-30 00:26:40,fixedgearbicycle,https://old.reddit.com/r/FixedGearBicycle/comments/sfpjmn/nothing_to_see_here_just_some_gts_in_the_wild/husdmof/,"Damn, your GT trees are blooming early, ready for picking soon. All that climate change, I say."
2022-08-04 21:11:26,climateskeptics,https://old.reddit.com/r/climateskeptics/comments/wg9tmv/change_my_mind_climate_change_is_real/iiyw0q2/,"We also believe man-made climate change is real.

We just know that it is an EXTREMELY minor player in climate change and will not lead to catastrophe.

Next."
2022-03-22 05:49:56,askreddit,https://old.reddit.com/r/AskReddit/comments/tjl4qu/whats_the_biggest_threat_to_humanity/i1mo4b0/,"Humanity will survive a lot, but civilization not so much. 

1st Nuclear War
2nd Pandemics
3rd Population decline 
4th Climate Change"
2022-07-18 06:17:39,worldnews,https://old.reddit.com/r/worldnews/comments/w1kwzu/union_calls_for_heat_limit_law_in_workplaces/igm1fk4/,Climate Change is basically rendering humans unable to work.
2022-08-25 01:58:03,futurology,https://old.reddit.com/r/Futurology/comments/wwldbu/congress_admits_ufos_not_manmade_says_threats/ilogree/,"Technically no, but I do keep up on most of latest as far climatology goes from published journals. Did you just show up to be irritating? Or did you actually have a counterpoint to the fact that it's still somewhat unknown as far what weather events can be attributed towards additional greenhouse gasses in the atmosphere and Earths natural climate change depending on the obliquity, ellipses, solar maximum, solar minimum."
2022-02-04 01:38:01,minnesotavikings,https://old.reddit.com/r/minnesotavikings/comments/sjlfix/can_we_all_agree_to_give_this_new_regime_a_chance/hvi4f1q/,Well worded. I personally understand people's reaction but also at the same time I really don't. KOC shows up with a deep understanding of the vikings roster and our flaws and also had ways to improve on em. Meanwhile Jim shows up and thinks his past record is gonna be enough to stand on. The league is changing and if we picked up Harbaugh we'd be short on cash and also stuck in the past. Now we have a chance to give these young guys the opportunity to analyze the current state of the game and build their entire future around figuring out how to win in this new climate. This is the change we've been waiting for since Childress..they'll come around eventually. Sadly we're probably gonna have a toxic sub until this team becomes a winning team and that might take till 2023.
2022-01-25 21:58:17,debateavegan,https://old.reddit.com/r/DebateAVegan/comments/rzn1z4/why_shouldnt_rvegan_be_classed_as_fake_news_if_it/hu7lihf/,"&gt;The argument often used is that not using this land for farming would lower emissions.

Yes, unless it can be proven to lower all inputs then it's a false metric.

In the USA, all agriculture is 10% as emissions. All animals are 5% and all ruminants, sheep, deer, goats, bison, cows etc are around 65% of that.

https://www.epa.gov/ghgemissions/sources-greenhouse-gas-emissions#agriculture https://www.epa.gov/ghgemissions/overview-greenhouse-gases#methane

Cows are not all of the ruminants but even leaving them as the whole amount for this, any system that replaces the edible and inedible has to be able to show a lowering of 3.25% of emissions to replace everything we get, not just the edible, considering man made emissions are half natural ones this is 1.625% of total emissions to replace everything from wool to pet food to leather to protein.

People will then say 14.5% is from animals worldwide but this is wrong in a couple of ways, the people who use animals for draught power, dung for fuel and milk for food, these people aren't sending cattle to market in great quantities, the people that are and saying the complete life cycle that includes processing, transport etc are ignoring that the same lifecycle of processing and transport etc is still going to be needed and quite likely more of it is going to be needed as whatever is grown is going to be needed to be processed to be turned into a higher quality product than its raw form, as my conversation with u/FlabberBabble shows, saying we can replace 10% of the product we receive and only use 10% of the land and because we have replaced beef ( with a less nutritional product ) and that's the end of it is such a false way of looking at things.

&gt;The comparison measures direct emissions from transport against both direct and indirect emissions from livestock. 


&gt;‘The Intergovernmental Panel on Climate Change (IPCC) . . . estimates that direct emissions from transport (road, air, rail and maritime) account for 6.9 gigatons per year, about 14% of all emissions from human activities. These emissions mainly consist of carbon dioxide and nitrous oxide from fuel combustion. By comparison, direct emissions from livestock account for 2.3 gigatons of CO2 equivalent, or 5% of the total. They consist of methane and nitrous oxide from rumen digestion and manure management.

5% of direct emissions and then using whole life cycle emissions of transport, processing etc but ignoring the same processing etc will be needed is why the IPCC have also come out and said recently that they have over estimated the warming potential of cow methane by a factor of 3-4 and under estimated new methane from fossil fuels.

&gt;Using GWP*, the projected climate impacts show that CH4 emissions from the U.S. cattle industry have not contributed additional warming since 1986

https://cabiagbio.biomedcentral.com/articles/10.1186/s43170-021-00041-y

To say that we should put tractors, synthetic fertilisers, insecticides, herbicides, fungicides in all using diesel, with the sowing and harvesting in and it will lower this 3.25% for all that we get is just a myth, one I think is pushed by food companies wanting to sell products and as long as there is 3% of the population who believe the myth based on their feelings towards animals and will fight for those feelings by getting arrested etc, then the food companies or people who say "" we can replace beef"" are using whatever they can to push their agenda.

Next you will have people say we can re-wild, this also is a false belief as it doesn't lower the biomass of animals in that area, if it can sustain wild animals like deer and goats then it will, more goats and deer can be held per hectare. If it can't hold animals and somehow the lack of nutrient means tree's can grow on this non arable land and grass etc can grow then fire is a cause for concern."
2022-04-04 22:20:22,worldnews,https://old.reddit.com/r/worldnews/comments/tw49gl/climate_change_ipcc_scientists_say_its_now_or/i3eukc3/,"While I appreciate your optimism, people living in the west will 100% very much notice the effects of global warming.

The current drought California is going through is the worst in modern history. It being fuelled by climate change, I wouldn’t hedge bets on it getting much better anytime soon (if at all).

Eventually something gives and people leave. That’s ~40 million people either suffering or displaced."
2022-02-18 03:59:13,movies,https://old.reddit.com/r/movies/comments/suv48v/why_walle_offers_stronger_satire_than_dont_look_up/hxejx3w/,"Dude, polling consistently shows people want to act on climate change. Reddit is even more liberal than the nation as a whole. What we don't like is a movie hitting you over the head with the same message we all know and then all its fans acting like they're smarter than everyone."
2022-04-06 19:06:33,oregon,https://old.reddit.com/r/oregon/comments/txqzal/any_tips_on_dealing_with_seasonal_depression/i3nwnvk/,"It sort of does, that said, what you project can have a huge effect on how you feel.  

I too moved here from the desert, because of the hopes of rain and gloom(it’s less of both than I had hopped for), the never ending sun was getting to me seasonally depressed. 

I fully embraced the weather here, got a good rain jacket and am happier than ever. 

Not to say that seasonal depression is not real, but rather that you moved to a place that you knew would have different climate and you didn’t change your expectations of what the daily climate would be like. 
Having a social circle does help. MeetUp is a great app that helps you meet up with a variety of people and activities."
2022-08-02 20:30:15,whitepeopletwitter,https://old.reddit.com/r/WhitePeopleTwitter/comments/wdwsd6/he_said_what_we_are_all_thinking/iiowcuh/,"This is a whole world situation. Right wing nonsense is springing up everywhere. Putin is on the loose. Conservatives just won lots of UK parliament seats, despite what just happened with Boris being clowned. 

The EU is seeing rising problems, as well. Remember, lots of scary brown folk from Muslim countries have already been streaming up that way, and its having it's unsurprising effect. 

The bulk of our First World privileges are 50ish years old. Politics moves slow, but like a train, once its going, its going. So there's a rising backlash across the world to all this ""progressive"" stuff. The historically ruling classes don't care for any of it, and they can fund whatever puppets they care to, everywhere. 

And climate change is here, the wolf is in the house. Everything we were warned about is coming to fruition. We weren't just warned about melting icebergs, but war, famine, strife. 

I can't blame anybody who flees to Denmark, but lets fucking face it, the majority of us just aren't in a position for that. The wealthy whites with nice nest eggs will find a way, but the rest of us are undesirables and can't buy our way in, or out. It costs $2000 just to stop the US from expecting a tax return from you no matter where you live now. 

You're gonna have to stand and fight, whatever that means. 

And they're right. If the world's biggest military falls to fascism, it's going to make Nazi Germany look like the Proud Boys. Who's gonna save us? China? lol. lmao. China down South, Russia to the East, and the US to wherever the fuck it wants, all of them fascist authoritarian oligarchies. That's impossible and there's nowhere to go. 

Until somebody puts a better option in your hand, vote, and don't stop voting."
2022-05-22 21:07:04,teenagers,https://old.reddit.com/r/teenagers/comments/uv8xwb/tell_me_your_controversial_opinions_i_wont_judge/i9lwraa/,Human beings overall are incredibly hypocritical when it comes to climate change overall (including me) we wouldn’t need all the regulations and plans we propose if we just took more personal responsibility and consciously bought  more products from companies that are much more green and buy less products overall. That being said it is much more complicated than that but I feel like it would go a long way.
2022-03-07 16:30:37,oklahoma,https://old.reddit.com/r/oklahoma/comments/t8fzji/oklahoma_is_advancing_a_bill_that_would/hzpx4im/,"All I have ever heard from the pro-gun lobby is ""It's a slippery slope! If we ban one gun, then they will ban all of them!"" Meanwhile, they are passing ""Don't Say Gay"" bills and these new ""No Promo Homo"" laws. Or do they only care about the slippery slope when it is things they care about? Income inequality, food insecurity, unemployment, climate change, crime, poverty... We are facing real problems but THIS is what they focus on? Do these legislators have nothing better to do with their time?"
2022-06-09 00:51:30,climateskeptics,https://old.reddit.com/r/climateskeptics/comments/v82tge/please_take_this_survey/iboe0qw/,"While I respect your opinion, it is completely wrong . Co2 and  methane are impacting the climate and it is not something that is a mystery.  Taking this survey doesn't mean that you believe in climate change because you have an opportunity to vote a 1out of 10  so....."
2022-07-11 21:36:40,antiwork,https://old.reddit.com/r/antiwork/comments/vwny2s/a_rude_awakening_is_ahead_for_young_employees/ifryarb/,"I guess it's a matter of how far along the spectrum do you place blame of bad governments at the feet of ordinary citizens. Media and consumerism can be serious weapons.

And not to let that generation off the hook, but it was also boomers who pushed the fact that climate change is real into mainstream, and called out the housing markets.

Right now there are 16 year olds in TikTok houses unironically claiming fame is something to strive for and talk about money and wealth more disparagingly than any boomer rapper. We all have our problems. Also Didn't the greatest generation also pollute every natural being in sight lol?"
2022-08-18 18:19:36,politics,https://old.reddit.com/r/politics/comments/wrgarf/first_thing_florida_republicans_targeted_black/ikts4zf/,"No Iraq war, no Bush tax cuts, no ""no child left behind.""  
There's an argument that could be made about 9/11 being prevented, but even if it happened Afghanistan [would have likely gone differently](https://www.foreign.senate.gov/imo/media/doc/Tora_Bora_Report.pdf?)  


Instead we would have seen the Medicare lockbox and expansion (similar to Medicare Part D but without the ""donut hole""), an eventual push toward universal health care, more progressive tax policies with middle class breaks for education, childcare, and tech investment, and a huge push for environmental activism with policies aimed at fighting climate change. You know, things we're still fighting to pass in Congress 22 years later. 

It's an entirely different world if Gore becomes president"
2022-03-05 15:19:21,morbidreality,https://old.reddit.com/r/MorbidReality/comments/t76d9o/easily_over_a_1000_people_forced_onto_a_beach_by/hzgjm3p/,"If the world ten raises .4 degrees more we will be at a point of no return according to some new research


https://www.npr.org/2021/11/08/1052198840/1-5-degrees-warming-climate-change"
2022-04-07 17:30:41,ukraine,https://old.reddit.com/r/ukraine/comments/ty7qle/a_russian_vessel_request_fuel_off_the_coast_of/i3scsyk/,"Have you read the latest IPCC report? We're already screwed.

The world has until 2025 to hit peak emissions and then must begin to  draw them down, or limiting warming to +1.5C is unattainable. No way that deadline will be met. We will see +1.5C by the 2030s,and +2C not long after.

Worrying about nukes seems rather pointless compared to that. Take the risk and stop the war, that's the only hope  we have to mitigate the worst effects of climate change."
2022-05-19 18:00:06,iama,https://old.reddit.com/r/IAmA/comments/ut7yj0/im_bill_gates_cochair_of_the_bill_and_melinda/i98ag30/,"You do know he's trying to make billions more (apparently he doesn't have enough) by shorting Tesla, the company that's done more for climate change than any others?

He doesn't care about climate change. He cares about money."
2022-08-19 16:32:27,alberta,https://old.reddit.com/r/alberta/comments/wsbdb2/is_it_my_imagination_or_is_the_trucker_protest/ikybnz0/,"The actual convoy movement (I prefer not to call it a trucker protest, as the actual truckers, a huge number of whom are Sikhs and other POC, were not involved, let alone supporters) may be shrinking, *but the followers are still out there*, and they'll be back.   Global societies are under severe stress due to climate change, migration and war, and it is only a matter of time -- not much I think -- before a new idiocy grabs their attention and allegiance.    And the next one could be bigger, because that's how fascism works.

Time to start building defences, within Canada and, frankly, along the world's longest undefended border.  Because they *will* be back."
2022-03-05 02:01:13,canada,https://old.reddit.com/r/canada/comments/t6kt3w/this_is_crazy_gas_hikes_shortages_as_further/hzeddk3/,Do you honestly think there is a single person or group of people that can save you from climate change? Get a grip man.
2022-07-16 03:32:06,worldnews,https://old.reddit.com/r/worldnews/comments/vzy2wj/national_emergency_declared_after_uks_first_red/igcntqu/,But not enough of an emergency to act on climate change apparently
2022-07-24 19:56:26,latestagecapitalism,https://old.reddit.com/r/LateStageCapitalism/comments/w5i5hf/these_events_arent_just_tragedies_theyre_crimes/ihhkhc0/,"Not so much...

https://ourworldindata.org/grapher/exports/heat-wave-index-usa.png?v=1

https://www.statista.com/statistics/1293872/us-heat-wave-index/

Unfortunately, we don't have solid data from before the 1890s.  And this chart is only for the U.S., but the U.S. has far more comprehensive data than other countries.



it's kinda funny, but also frustrating, to look at sites like epa.gov that show an increase in heatwaves.  These charts start in the 1960s.  Gee... I wonder why!  I wonder if there is a clue in the charts that go back to the 1890s...

https://www.epa.gov/climate-indicators/climate-change-indicators-heat-waves"
2022-08-03 16:14:00,lgbtmemes,https://old.reddit.com/r/lgbtmemes/comments/wemwzu/based_on_a_true_story/iisr9oh/,Priests and religious people pretty much say it all the time. They think homosexuality is a mental disorder from the devil that exists to challenge your faith in god. Heard these exact words from a hardcore moslem. He also said the world might end soon because of the western world's gayness and that climate change is the first indication of that.
2022-01-02 22:07:26,belgium,https://old.reddit.com/r/belgium/comments/rue0fq/2022_has_just_started_and_the_weather_is_already/hqzo3ah/,"I don’t even know what you’re trying to say? That climate change isn’t real? It’s been a historically hot Jan 1st and 2nd. There’s tons and tons of real world examples of climate change. Forest fires in Colorado in fucking December ffs.

If it talks like a duck and quacks like a duck…."
2022-05-25 04:43:30,conspiracy,https://old.reddit.com/r/conspiracy/comments/ux4aye/can_you_handle_the_real_truth_behind_climate/i9wd693/,"I think fixating on climate change was a mistake. Why can’t we just be good stewards of the Earth. Clean air, clean water, limit pollution, limit habitat loss etc. I have always believed it doesn’t matter if climate change is man made or not, we can do better for our planet and we should. Banning plastic straws shouldn’t be political, we should just all recognize it is the right thing to do as care takers of our planet. I love nature and I don’t want to see it destroyed by greed, end of story. Sorry but all this is a waste of time OP."
2022-08-17 04:40:06,ocpoetry,https://old.reddit.com/r/OCPoetry/comments/wq92c3/september_falls/ikm8ttu/,"Oh I get it, I truly hate summers where I'm from. At least these days because of climate change. It never used to get above 88 degrees which was already way to hot for me. Now its hottest days can get up to 107 degrees. My state is dying and it makes me so sad. Fall and winter are the only times I get some peace and really feel like myself. Although Winters have their new extremes as well. Most years it can fall to -30 below but I'm kind of a freak and love it when it's that cold just not much colder lol."
2022-06-11 19:28:38,worldnews,https://old.reddit.com/r/worldnews/comments/v9w146/up_to_300000_tonnes_of_grain_in_destroyed/ic08thg/,"Dunno about that. 2022 is shaping up to be a bad crop year across most of the Northern Hemisphere due to extreme weather / climate change.

When most of the grain exporting regions of the world have droughts in the same year, there won't be much surplus to share. 


https://farmpolicynews.illinois.edu/2022/05/global-wheat-production-faces-weather-threats-while-u-s-food-prices-climb/


https://time.com/6175997/wheat-food-weather-climate/"
2022-07-29 15:58:31,leopardsatemyface,https://old.reddit.com/r/LeopardsAteMyFace/comments/wb7o7d/i_never_dreamed_that_how_i_vote_could_affect_the/ii54om1/,"Weather is not climate

Just like that idiot congressman who brought a snowball to claim climate change isn't real, you can't point to every flooding event and claim it's because of climate change"
2022-06-06 01:04:51,changemyview,https://old.reddit.com/r/changemyview/comments/v5qtu9/cmv_climate_change_is_inevitable_unstoppable_and/ibbdi7x/,"What do you mean by climate change?  Presumably you are talking about human-caused global warming.  We have already caused the globe to warm, so obviously we cannot prevent that from happening at all.  You must mean something more specific, like more than some certain amount of warming.

What is it that you think will happen that is not preventable?"
2022-07-15 22:55:08,whitepeopletwitter,https://old.reddit.com/r/WhitePeopleTwitter/comments/vzz25h/hes_been_released_no_charges_filed/igbq433/,"So they will do nothing...which is what I said. Democrats who are in power will do absolutely nothing about this. You can make any excuse you want for them but unless they are willing to act all your outrage is meaningless and this will continue. Unless you have the courage to fight back how surprised can you be that you keep getting pushed around. They wont even defend their own members what does that say about abortion, climate change, voting rights...

Yet thousands of people get online to make excuses for their inaction as if it matters. This will continue and get worse until Democrats fight back. But by all means keep making excuses for them..."
