date,subreddit.name,permalink,text
2022-04-21 16:05:26,facepalm,https://old.reddit.com/r/facepalm/comments/u8k571/gluing_themselves_to_table_is_is_so_brave_wow/i5mrf00/,"selfless ≠ independent. It’s selfless because this action is for the benefit of others, not themselves (the activists).

I can’t believe you are genuinely suggesting animal rights activists, climate activists, and humans rights activists are

A) not doing a selfless thing and B

B) deserve to die

because of their form of non-violent protest. Change your name to DrSociopath maybe"
2022-07-16 08:52:05,inceltear,https://old.reddit.com/r/IncelTear/comments/w08i98/the_birth_of_an_incel/igdgiqb/,"A large part of it is down to social media and the algorithms that carefully curate the content that we see online. All it takes is for someone to  Google ""how to pick up women"" or ""how to get a girlfriend"" or ""how to make myself more attractive"" etc and then Google, facebook, reddit and other sites will start suggesting similar content and things it thinks might interest you. From there slightly more extreme content is occasionally introduced and because you only see content from like-minded people it creates this echo chamber where all sorts of views and ideas are normalised to you. It leads people to gaining a lot of validation for more and more extreme views. Which is why you often hear about incels saying that they used to be red pill but now they are ""insert more extreme pill here"". 

This is a problem with so many areas of society and a big part of the reason why we see more and more polarisation about things like climate change, vaccines, politics, racism and so many other things

Of course you can't deny the impact of a society that teaches young men that sex and status is more important than anything else and that teaches everyone that women are valuable only for their looks. But the way these algorithms work is a huge part of the radicalisation we see online."
2022-08-15 02:09:03,neoliberal,https://old.reddit.com/r/neoliberal/comments/wnzyb0/discussion_thread/ikby6s8/,I guess between being the inflection point of whether we get merely disastrous or totally calamitous climate change and potential WWIII?
2022-01-13 15:11:39,politics,https://old.reddit.com/r/politics/comments/s31n60/is_the_us_uniquely_bad_at_tackling_climate_change/hsht1ez/,"Your submission `Is the U.S. uniquely bad at tackling climate change?` was automatically removed because `yaleclimateconnections.org` is not on our [approved domains list](https://www.reddit.com/r/politics/wiki/approveddomainslist). r/politics has a number of conditions that domains must adhere to in order to be approved as an acceptable source. Domains must:

* Be notable, as defined by our [**domain notability guidelines**](https://www.reddit.com/r/politics/wiki/approveddomainslist). Notable domains will consist of news organizations, research organizations, political advocacy groups, governmental agencies / bodies, and political parties. 
* Contain articles, videos or sound-clips relevant to current US politics
* Contain original content that has not been stolen or rehosted from another source. 
* Be accessible at least once **without** paying for a subscription or completing a survey. 

If you believe that you have a domain that is eligible for our approved domains list, please use the link at the end of this message to submit it to us. However please note that if you submit spam or rule breaking content to us via the form, we will match the domain against this submission and may take action against your account. If you submit a spam domain via the form, your account may be reported to the site administrators. To submit a domain for approval [use this form](https://goo.gl/forms/lRQikA1rI0bVbKCl1) and follow the instructions provided


*I am a bot, and this action was performed automatically. Please [contact the moderators of this subreddit](/message/compose/?to=/r/politics) if you have any questions or concerns.*"
2022-01-27 12:50:28,environment,https://old.reddit.com/r/environment/comments/sdnv23/experts_eviscerate_joe_rogans_wackadoo_and_deadly/hufks3e/,"Everything else being equal, making people rich would considerably increase carbon emissions ([Oxfam report - page 4](https://www-cdn.oxfam.org/s3fs-public/file_attachments/mb-extreme-carbon-inequality-021215-en.pdf)). This is not a climate policy.

Seriously, let's stop listening to this idiot on climate change and climate policy. It's not his field. There are a lot of great experts to listen to."
2022-01-28 19:18:37,collapse,https://old.reddit.com/r/collapse/comments/seydez/children_are_our_future/humdj8n/,SS: people think their children will solve climate change. In reality they're just throwing little Timmy down the well. Maybe they are missing the point but if they could solve their problems with more of the same they would.
2022-03-01 06:31:03,facepalm,https://old.reddit.com/r/facepalm/comments/t3mk1u/would_you_support_or_oppose_bombing_agrabah/hyvsccr/,"You ever wondered if humanity will be able to solve world hunger? Create world peace? Overcome climate change?

I hope this answers that for you."
2022-08-19 20:59:08,collapse,https://old.reddit.com/r/collapse/comments/wsc61f/putting_a_positive_spin_on_the_death_of_99/ikzgoea/,"Corporations, his included, have a hard on for pushing the ""carbon footprint"" lie that attempts to shift all possible responsibilities of climate change to individuals rather than polluting corporations so that when shitbhits the fan people will blame themselves for not turning off the lights when they leave the room and not corporations being capitalist parasites."
2022-07-23 01:18:39,maine,https://old.reddit.com/r/Maine/comments/w5o6h3/morning_view_off_my_boat_we_dont_get_weekend/ih9mhzv/,"You wait, the “blame” will be placed on overfishing and not on society ignoring global climate change and our misuse of the planet with toxins &amp; pollutants dumped into the ocean."
2022-02-17 15:56:33,vaushv,https://old.reddit.com/r/VaushV/comments/suneri/canadian_exceptionalism/hxbkjc5/,"I think this is the type of complacency that some people in the better social democracies can easily fall into. You have a good standard of living, comparatively decent labor rights, affordable healthcare and general stability. In most indexes that measure how well a nation is doing, yours is at the top. Comparatively, your country is doing very well, so you stop expecting more, and maybe even start downplaying some things that are worth condemnation.

*Part of the public sector got privatized? That's not good, but I mean, just look at how bad America is doing in that regard. Labor protests were extinguished via legislation? I don't approve, but we do get two weeks of paid vacation time here. We have taken measures to fight climate change, but could we be doing more? Sure, we could be, but how much can you expect from us when America is resting on its laurels? This is an extreme measure to take, and I'm somewhat weary of it, but our government is generally pretty good, so how bad is it really? I say we have trust in them.*

That type of attitude, whether it's more subtle or explicit than how I depicted it as, is the type of complacency that leads to slow stagnation and decay of these better social democracies. Scrutiny is a necessity."
2022-08-16 23:50:06,bitcoin,https://old.reddit.com/r/Bitcoin/comments/wq5k9j/i_used_up_45_pounds_of_resin_and_glass_and/ikl8ek0/,Meanwhile climate change is raging… yes.. very much worth it…
2022-04-24 00:00:13,nostupidquestions,https://old.reddit.com/r/NoStupidQuestions/comments/uahrsb/why_are_centrists_so_hated/i5xu1ry/,"when they say ""why does everything have to be left or right"" in my experience it usually means why does every solution have to be the extreme. 

Like climate change for example, there’s the left ""shut down all fossil fuel power today and go vegan"" and the right ""climate change doesn’t exist"" narratives. A centrist view would be it doesn’t have to be one or the other, both could work together and come to a rational solution."
2022-02-01 00:41:39,decodingthegurus,https://old.reddit.com/r/DecodingTheGurus/comments/sgxbcx/joe_asks_jordan_peterson_what_kind_of_background/hv2hucl/,"Paul Saladino, interestingly enough he's been dipping his toe into the same climate change denying waters as Peterson.  He interviewed Patrick David Moore and Alex Epstein, so now he just needs to have Bjorn Lomborg on and he'll have a hat trick.

Edit:  Also, Paul has literally one study that suggests broccoli could be bad and he's constantly referencing it.  Funnily enough he never mentions that the study was done in diabetic alcoholics who were superdosing(smoothies) themselves with oxalates.  Classic guru tactic."
2022-07-25 22:03:25,newjersey,https://old.reddit.com/r/newjersey/comments/w7qwpz/heat/ihmwwby/,I’m fine with heat but not climate change heat.
2022-01-06 12:37:49,movies,https://old.reddit.com/r/movies/comments/rxc2c0/dont_look_up_officially_breaks_netflix_weekly/hrhfjnf/,"&gt; The problem is that with the comet it can be seen quite a fair way away

You’re suggesting there are no early signs of climate change?"
2022-08-29 11:57:36,news,https://old.reddit.com/r/news/comments/x09j8c/an_existential_dilemma_florida_homeowners/im8uont/,and they still keep electing climate change deniers
2022-06-04 18:00:58,vancouver,https://old.reddit.com/r/vancouver/comments/v4q54t/access_to_bcs_outdoors_limited_by_washroom/ib61ea8/,"That's the nature of disability. Using a hand-cycle is harder than using a normal bicycle. Same with wheelchairs or seeing eye dogs. We can spend as much time and money as we want, but until we have cybernetics or whatever, disabilities will make life more difficult by nature of taking away an ability. 

Your values may feel more moral to you, but there can exist someone who believes the deaths we actively cause by perpetuating climate change are worse than the discomfort we cause disabled people by not being world leaders in disabled infrastructure."
2022-07-20 23:15:01,memes,https://old.reddit.com/r/memes/comments/w3jjh3/leave_us_alone_please/igzahmj/,"Friend, perhaps I chose my words poorly, I mean we should put aside the bickering and fix our common issues, I chose as an example, climate change. There are many worthy causes, however that was first in mind."
2022-02-22 21:15:40,selfawarewolves,https://old.reddit.com/r/SelfAwarewolves/comments/syr9fo/rick_scotts_awful_11point_plan_we_believe_in/hy0jyrl/,"By their own admission, [""For the unvaccinated, you’re looking at a winter of severe illness and death for yourselves, your families, and the hospitals you may soon overwhelm.""](https://www.whitehouse.gov/briefing-room/press-briefings/2021/12/17/press-briefing-by-white-house-covid-19-response-team-and-public-health-officials-74/)

On climate change, they've done nothing to address root causes. Hell, they're [approving more production than ever.](https://www.washingtonpost.com/politics/2021/12/06/biden-is-approving-more-oil-gas-drilling-permits-public-lands-than-trump-analysis-finds/) Sure, they're throwing money to corporations who use reusable energy, but they're not curbing fossil fuel usage. Petro sales are too profitable to be moved by even the biggest carrot in the world. You *need* a stick. Even then, the country's very infrastructure is built to consume as much energy as possible. It's impossible to live outside of the cities without a personal vehicle, and even urban areas are designed from the ground up around cars.

The infrastructure bill is in the same boat as climate change: it's designed to prop up a failing system rather than promote a better one.

On ""democratic integrity,"" there's no integrity in the system even when everybody is included and able to easily vote. Current campaign finance laws ensure that the best path to power is pandering to special interests and then doing absolutely anything to convince the public that you do something, *anything,* other than what you do. That's the reason why so much of our circus of a political scene is completely ephemeral culture war bullshit. Nobody's allowed to look at the specific factors influencing our material conditions. It's not up for discussion."
2022-04-22 11:38:11,mildlyinfuriating,https://old.reddit.com/r/mildlyinfuriating/comments/u94bo7/so_many_tires_to_burn_and_create_toxic_pollution/i5qj5a2/,"""Just recycle, don't buy plastic straws, just put your heater two degrees down, "" I fucking hate that shit like this can happen and nothing gets done about it by governments while all the blame and responsibility for fixing climate change gets put on the individual. This shit makes me so angry."
2022-05-08 01:59:21,pakistan,https://old.reddit.com/r/pakistan/comments/uk949w/countries_scaled_by_co2_emissions_in_2020/i7qytoy/,"Pakistan will pay the price. We are at high risk for climate change.
Heat wave glaciers melting caused flood today."
2022-07-15 07:03:16,collapsesupport,https://old.reddit.com/r/CollapseSupport/comments/vz0vg6/im_feeling_anxious_confused_stressed_and/ig8h1jb/,"&gt;It's harder, too, when you are surrounded by people who move through life as if everything is business as usual. It feels invalidating, and makes that pain harder to process.

Tell me about it. My mom is a fox news and breitbart junkie, an anti-vaxxer, a Christian, an alcoholic, and a racist bigoted trump support to boot. She's just now coming around on climate change, which she denied for her entire life, now that it's basically undeniable. Living with her, it's driving me damn mad. She blames all of the world's problems on black people, immigrants, ""demon democrats"", and everyone else who isn't white, basically. I have nobody to talk to about this aside from my ex-gf IRL. Ya'll don't understand how frustrating it is living in a deep-red state, surrounded my insane morons. It's hell. I live in hell.

&gt;You're young. What are your passions? What do you enjoy doing?

I'm a fucking no-life nerd, and I always have been. I love it and make no apology for it. In whatever free time I have left I enjoy playing video games, watching movies / anime, hanging out with my husky, writing, spending time with my friend or my FWB, and listening to music. I want to start making YouTube videos, as well. I love writing, particularly about society, film / games, and I also have a bunch of ideas for some skits I'd like to make just for fun. I do like to be in nature though, there's a lake behind my neighborhood with a lot of ducks, turtles, birds, and wild cats that live around here. That's where I do most of my writing and walk my dog every day. I also really want to get back in the gym, which I haven't done since I got injured a long time ago, and then covid hit after I recovered.

It's hard to get myself to do stuff though. I've been depressed since I was probably 14 or 15, not because of collapse, but because of other things. I abused a bunch of different drugs for many years, between 14 - 22. I'm mostly clean now. I have a blacklist of stuff I'll never touch or try though (no pills, no needles, no powders) so I'm lucky that I didn't fall into the seriously hard stuff. Mainly just weed, alcohol, nicotine, psychedelics, and some other fringe things I tried once or twice, like cough syrup, kratom, or nerve blockers. Didn't really like those TBH.

&gt;More than anything, allow yourself to feel anger and grief.

Oh, don't worry about that LMAO I'm all checked out there.

&gt;Showing up to those things will help you build community with like-minded people, and may reassure you that you are not the only person in this existential fight.

Planting trees actually sounds kind of fun. I wish I could create a garden but I don't have a yard where I live.

&gt;Laugh to spite the hatred. We are in a dark time and we can surrender to it or we can fight. Everyone gets to choose. I choose to fight.

I'm not going to give up. I'm clownpilled at this point. The world is a big joke. I want to see how bad things can truly get before people start blasting eachother on sight. I've played way too much Fallout 3 and Fallout New Vegas to give up before I get to experience living in a real wasteland, LOL.

Thanks for reading."
2022-08-19 23:45:41,cisparenttranskid,https://old.reddit.com/r/cisparenttranskid/comments/wspp33/my_daughter_thinks_she_may_be_trans/il042lz/,"A common joke in the queer community is that once one person in a friend group comes out, it’s only a matter of time before the rest do too. This isn’t because of a ‘social contagion’ or anything, it’s because like-minded people tend to flock together.

Your kid has probably been thinking about this for months before telling a soul - and it’s a good sign they’re coming to you first! Your kid trusts you enough to be very vulnerable with you, and they know you’ll support them and pick them up when they fall. A lot of parents never earn that privilege, so you’re doing something right.

I would advise you follow your kid’s lead here. Ask them what they need. A good starting point to experiment is some new clothes and a haircut - all reversible if they don’t like it, but a definite morale boost if they do. Ask them what pronouns they want you to use, and if they want to go by a new name. A chest binder is also a great investment - it’s a compression shirt that flattens a person’s chest, similar to a sports bra or spanx. You can get one for around $35 online from reputable companies like GC2B or Underworks. They’re completely safe if you wear them for at most 8 hours at a time and take breaks often.

Your kid may know exactly what they want, or they may not. The first year or so is very experimental for almost everyone, it could take time before they land on what works socially. Your job here is to let them experiment freely and understand things maybe temporary. It’s actually pretty fun! Your kid will find their groove eventually.

Past that, my experience as a trans man (female to male) in the US has been thus: You won’t be rushed into doing anything hormones or surgery-related. There’s actually mandatory waiting periods of at least six months living socially transitioned before starting hormones! When that had passed, I talked with my therapist and she referred me to an endocrinologist. My testosterone is pretty cheap with insurance, about $15 a month for daily gel. Surgery has several hoops to jump through and takes time and money, but I have no personal experience going through it. Name change and gender change laws vary by area, LegalZoom was a massive help for my name change when I was ready.

None of the steps above are a given by the way! I personally am happy with testosterone therapy and my social and legal transition without any surgery. Your kid may/may not want any combination of those things, and they’re no less trans for it.

We’re done with their steps for transition, now on to yours. You’re gonna have some feelings, and that’s ok. It’s a mourning process in a way - not for your kid themselves, but for your expectations of them. You may be looking forward to walking your kid down the aisle or seeing them holding your first grandbaby. It is natural and necessary to feel it and process it. This is something you do in private, out of your kid’s earshot. They’ve gone through that same mourning process already with expectations of themselves, and now that they’re through it they’re ready to move on. Us trans folk can forget that not everyone is on same page, and it can feel awful to hear someone else mourning you in front of your face. Feelings may get hurt that way.

If they want to go by a new name and pronouns, take the time to actively practice them. It’s a massive change after 18 years, but you can do it. It gets more natural and normal the more you hear and say it.

Lastly, keep faith and trust the process. It’s a scary social climate to be trans right now, and it’s instinct to want your baby to have an easy life. You love them and want the best for them. It’ll be hard for a while for both of you, but the effort is so so worth it. I am a more fully realized person now that I transitioned, and happier than I ever thought I could be. There are so many trans people leading full happy lives, more than any scary statistics could show. I encourage you to seek out stories of trans elders - To Survive on This Shore by Jess Dugan is a beautiful read.

You are your kid’s cheerleader and advocate, and they’ll need someone to lean on right now. I have utmost faith you can be just that. I wish both of y’all the best starting this journey! There may be a PFLAG chapter or other local LGBT groups near you, they’ll have support groups and resources that can help you. My dm’s are always open if you have questions too! I started social transition at 16 and hormones at 18 a couple years ago so we’ve got similar timelines going"
2022-02-09 18:47:35,environment,https://old.reddit.com/r/environment/comments/sokrz0/published_paper_climate_change_experiences_raise/hw9cm8y/,"Abstract:

Public support is fundamental in scaling up actions to limit global warming. Here, we analyse how the experience of climate extremes influences people’s environmental attitudes and willingness to vote for Green parties in Europe. To this end, we combined high-resolution climatological data with regionally aggregated, harmonized Eurobarometer data (34 countries) and European Parliamentary electoral data (28 countries). Our findings show a significant and sizeable effect of temperature anomalies, heat episodes and dry spells on environmental concern and voting for Green parties. The magnitude of the climate effect differs substantially across European regions. It is stronger in regions with a cooler Continental or temperate Atlantic climate and weaker in regions with a warmer Mediterranean climate. The relationships are moderated by regional income level suggesting that climate change experiences increase public support for climate action but only under favourable economic conditions. The findings have important implications for the current efforts to promote climate action in line with the Paris Agreement."
2022-01-19 11:25:09,chennai,https://old.reddit.com/r/Chennai/comments/s7kztf/deleted_by_user/htb061a/,"This is a fundamental problem with how the economy is structured tbh. Cricketers in India are paid more than players of any other sport simply because cricket is the one that generates maximum profit through advertising at the end of every over etc. Actually, in what way is a movie star or cricketer contributing more to society than a good teacher, good policeman, honest &amp; effective civil servant, etc? And before you point out that there hardly any ""good"" (i.e. effective, hard-working *and* non-corrupt) people in those professions, the very reason behind so many trashy individuals being employed in those fields is because people with more skills AND integrity will take those qualities to fields which reward those qualities more (&amp; become specialist doctors, IIT/NIT/BITS graduate software engineers, experts in high finance etc) instead.

 The only exception are IAS, IPS types but very soon they too give up trying to make a difference simply because they most often CAN'T in a system that - more than anything - doesn't WANT things to improve, and so will do their best to maintain the status quo. After all, if vast majority of average Indians - especially in UP, Bihar etc - got educated, had wellpaying jobs etc, then they can no longer be SO easily manipulated &amp; fooled by the useless old men who just want to rule &amp; pocket corruption money till the day they die. I honestly think the only way things can even slightly improve is for the world to realize that every billionaire is fundamentally evil because he's hording WAY more wealth than he deserves (wealth that is mainly made by evading taxes &amp; withholding profits that should've been redistributed among all his employees around the world as increased salaries or at least bonuses - after all, if it's ok for people to lose jobs when the company's stocks are down, why shouldn't they get bonuses when the stock goes up? How can people not see that any economic system under which 99.9% of the world's population is suffering under, and is literally KILLING the planet, all for the benefit of just 0.1%, is a *failed* system?).

 Realizing all the above, followed by a French Revolution style people's uprising, marching into the homes of the ultra rich &amp; corrupt politicians, and actually chopping their heads off (so that for the next few decades at least, governments &amp; employers alike will LEARN THE HARD WAY to treat their people with the fear &amp; respect they deserve) is the only way any real change will ever happen. Otherwise climate change disasters, resource wars, &amp; economic collapse will make life hell for the rest of us, while the 0.1%, their descendents &amp; their few favorite pet political dogs will chill comfortably on their well-stocked &amp; protected luxury private islands."
