date,subreddit.name,permalink,text
2022-08-11 02:56:22,australia,https://old.reddit.com/r/australia/comments/wl9lr1/the_cost_of_negative_gearing_tax_concessions_is/ijt5kfc/,"Possibly. I admire your optimism and it would be nation building to fuck NG off, that's for sure.

Society can stomach climate change action because it doesn't technically cost them anything up front, unlike negative gearing being removed. Murdoch rags and those that follow suit (Ch7, 10, ABC) will have a field day if the ALP tackled NG.

We can only hope at this stage!"
2022-02-14 01:07:07,futurology,https://old.reddit.com/r/Futurology/comments/srohma/new_reactor_in_belgium_could_recycle_nuclear/hwunudz/,"Not really no. While climate does change naturally over time, it's happening so fast now that we can see it. That part is unprecedented. And we have seen and known this for decades even if certain groups of people are trying to deny that the alams were blaring already."
2022-05-18 11:52:33,askreddit,https://old.reddit.com/r/AskReddit/comments/usawe7/why_dont_we_talk_about_bruno/i929rfz/,"What a stupid concept. 

All these scientists are responsible for climate change- Dave and his damn microscope are the cause of rising sea levels!"
2022-04-06 02:07:22,socialism,https://old.reddit.com/r/socialism/comments/tx2bk2/what_type_of_socialists_are_you_guys/i3knuw9/,"Eco-socialist here.

Emphasis on environmental reasons for fairly obvious reasons (*cough* climate change *cough*)

Would be a communist technically, but given the scale of the collective action problem of climate change, i think for the near future we are stuck with nation states and they offer the most robust way of handling global climate problems given how productive power is currently distributed. 

But barring that, yeah I'm a communist (no comment on specifics for achieving like vanguard vs continuous international vs whatever else)"
2022-06-02 23:31:23,collapse,https://old.reddit.com/r/collapse/comments/v33clk/thousands_warned_of_doubling_power_bills_as/iaz1n8c/,"Well, that kind of fucks up the general belief that NZ is the climate change ‘utopia’ where people flee to once the world collapses. 
“Yeah it’s not hot in NZ yet, but groceries are $3000 a week via privatised drone delivery”"
2022-02-10 03:05:48,realtesla,https://old.reddit.com/r/RealTesla/comments/sosqvs/beijing_2022_sees_largest_use_of_hydrogenpowered/hwbg3qi/,"A lot of this seriously delusional. We get most of our lithium from spodumene mining. We do not get most of our lithium from salt deposits anymore since there are not that many good deposits. Not to mention it will require vast amounts of water in desert regions to get the rest of that stuff.

And we will need increase lithium production until we can meet a 200-300x increase needed to give everyone a BEV. It's extremely implausible that we can do this without causing amounts of environmental damage.

And you're handwaving of the waste problem is absurd. You can easily just say that CO₂ would be used up by biological organisms and pretend climate change isn't a problem. What climate change deniers are doing is no different than what you're doing here."
2022-07-16 12:41:04,news,https://old.reddit.com/r/news/comments/vzx9oy/climate_change_predicted_temps_for_2050_is_coming/igdzsf2/,"Unpopular opinion, I'm prepared for the downvoting but when I see headline like this I get an amount of sick joy knowing the same generation that routinely denied climate change and routinely voted for people who chose profit over the environment's future are now living in the repercussions.  If the predictions had been correct it would have been subsequent generations harmed for something that happened before they were even born.  

Course there are good people suffering as well now but I'm not gonna deny myself the schadenfreude"
2022-02-28 10:06:42,mycology,https://old.reddit.com/r/mycology/comments/t2p0rs/fantastic_fungi_is_bad_and_we_have_to_talk_about/hyrfefm/,"You should really read the post.  
  
&gt;[Newscaster] *""Hurricane Harvey has started to make landfall here on the Texas coast. More than 30,000 people are without power. And things are only expected to get worse.""*  
  
&gt;*""Climate change is one of the biggest threats to our present, our world, to the future of our planet.""*  
  
&gt;[Stamets] *""Viral pandemics occur periodically. Between 1347 and 1353, one third of the European population died from the Black Plague. The great flu pandemic of 1918, 2% of the world population died. Millions upon millions of people.""*  
  
&gt;[Stamets] *""We're all getting older, we'll all suffer some degree of dementia.""*  
  
&gt;*""severe anxiety and depression""*  
  
&gt;[Stamets] *""She had stage 4 breast cancer""*  
  
&gt;[Stamets] *""Unfortunately we're losing bees across the world in a dramatic die off that is very dangerous for the bio-security of this planet.""*  
  
&gt;[Stamets] *""I think everyone is aware of the threat potentially of bio-terrorism.""*  
  
&gt;[Stamets] *""We had these great cataclysmic extinction events, when the asteroids impacted the Earth, kebam, enormous amounts of debris was jettisoned into the atmosphere. Sunlight was cut off. Plants die, animals die.""*"
2022-08-12 01:25:23,damnthatsinteresting,https://old.reddit.com/r/Damnthatsinteresting/comments/wlql19/the_longest_river_in_france_dried_up_today/ijxraal/,"Yeah go get help for your bigotry. You need to realize that no one is innocent in this. There’s literally mountains of evidence that shows that all politicians have taken political contributions from special interest groups. If you think that oil is the only contributing factor to climate change I have a bridge to sell you. 

Www.follow the money.org

Go ahead and check it out. I’m sure you’ll find out chuck schumer &amp; co. is innocent. They literally take the largest contributions by far from one of the dirtiest industrial sector there is. But you most likely can’t comprehend this."
2022-04-23 01:11:01,antinatalism,https://old.reddit.com/r/antinatalism/comments/u95582/the_things_natalists_do/i5to2u5/,"Also we are just never going to. There's no way we'll ever even be a majority. In some places in Africa the average is 6+ kids/woman. Even if women hypothetically were liberated all around the globe (LOL) plenty will still want kids. 

People talk about how there won't be enough young people for the old in a couple of generations, but as technology progresses and more jobs are automated, there will be more people available for that which cannot be, such as elder care. 

That is of course if our species doesn't destroy itself via climate change or nuclear war. 

I honestly don't get why people care about our species continuing in general, though."
2022-05-29 16:28:10,economy,https://old.reddit.com/r/economy/comments/v0b6lt/gasoline_hits_record_high_during_memorial_day/iafxzfj/,"&gt;Head in hole democrats:  OH MY GOD, RECORD TEMPERATURES!  CLIMATE CHANGE!  HOLY SHIT BAN STRAWS  
&gt;  
&gt;Also head in hole democrats:  Yeah, new record high on gasoline, inflation through the roof and we're bleeding in every possible way.  What's new?"
2022-07-01 01:38:17,conspiracy,https://old.reddit.com/r/conspiracy/comments/vod079/the_supreme_court_just_nuked_federal_agencies_and/ieebmg5/,"Unfortunately, I doubt the control the Intelligence groups have over the political climate will go down anytime soon. The Catholic/Jesuit supremacy over American Intelligence is rather obvious, the Vatican has sought to take over America and destroy the protestantism ever since the masonic revolutions. Biden himself is one of the few Catholic presidents and Trump is all the same when it comes to the Jesuit ties:


[Trump worked for a CIA front company called Resorts International.](https://saidit.net/s/conspiracy/comments/86kd/trump_worked_for_a_cia_front_company_called/)


[President Trump’s cabinet consisted of several wealthy elites, including Goldman Sachs, Bilderberg, and former Rothschild banker, Wilbur Ross. Ross bailed Trump out of bankruptcy in the early 90’s, and repaid the favor, making him sec. of commerce years later.](https://saidit.net/s/conspiracy/comments/6pya/president_trumps_cabinet_consists_of_several/)


[The Illuminati card game predicted Donald Trump.](https://www.reddit.com/r/conspiracy/comments/skza9p/the_illuminati_card_game_predicted_many_future/)


[Trump’s sister donated $4 million to a Jesuit University.](https://saidit.net/s/Jesuits/comments/8d3f/trumps_sister_donated_4_million_to_jesuit/)


[Mulvaney claimed that Catholicism was the driving policy behind the Trump administration.](https://saidit.net/s/Jesuits/comments/8dw0/mulvaney_claimed_that_catholicism_was_the_driving/)

Trump himself went to many Jesuit schools and the CIA is overall a Catholic, Jesuit shithole:

[The fact that they have been controlling the Vatican for hundreds of years needs to be made clear.](https://saidit.net/s/Jesuits/comments/7kr9/compilation_of_quotes_about_the_jesuit_control/)

Both Hitler and Himmler admitted the influence the Jesuits had on the ideals of the national socialists... and it was the Vatican that [allowed many of them to escape, out of which many of them helped in the creation of the CIA and were part of many of its operations.](https://saidit.net/s/Jesuits/comments/79fi/the_vaticans_role_in_the_escape_of_the_national/)

[The founding father of the CIA, William J. Donovan was granted the Grand Cross of the Order of St. Sylvester.](https://saidit.net/s/Jesuits/comments/7hjn/the_founding_father_of_the_cia_william_j_donovan/) Only like a hundred men have been given this award... and it is granted by the pope himself because of some service to the Vatican.

[The CIA's director of intelligence Allen Dulles and the Jesuit priest Avery Dulles were blood related.](https://saidit.net/s/Jesuits/comments/766j/the_relationship_between_the_cias_director_of/) Allen was also the CIA director that was in power for the longest time.

Like Donovan, [the CIA's director John A. McCone was given the Grand Cross of the Order of St. Sylvester because of his service to the Vatican.](https://saidit.net/s/Jesuits/comments/7j0n/cia_director_john_a_mccone_was_given_the_grand/) John was also involved in the creation of the CIA itself.

Finally, the CIA itself is a Catholic organization, like its nickname implies. [Which Catholics themselves openly boost about through their media.](https://saidit.net/s/Jesuits/comments/70a1/why_catholics_thrive_in_the_cia_catholic_herald/)

[Doctor Stephen D. Mumford,](http://population-security.org/mumford_bio.html) wrote in American democracy &amp; the Vatican: Population Growth &amp; national security, pg 172:

""The CIA serves as an agency through which secret assistance to the Holy Mother Roman Catholic Church can be provided by secret American society members acting as her defenders.

For creating the Office of Strategic Services [OSS], the wartime predecessor to the CIA, and this special arrangement with the Vatican, General William (Wild Bill) Donovan was decorated in July 1944 by Pope Pius XII with the Grand Cross of the Order of Saint Sylvester, the oldest and most prestigious of papal knighthoods. This award has been given to only one hundred other men in history, who by feat of arms or writing or outstanding deeds have spread the faith and have safeguarded and championed the Roman Catholic Church.

Donovan did more to safeguard and champion the Roman Catholic Church than any other American, and he was rewarded for his services with the highest Roman Catholic award ever received by an American. No doubt, thousands of others have striven with their deeds for similar recognition.""

Former CIA officer E. Howard Hunt said in an interview in the documentary ""A Coup Made in America"" which aired on Canadian television series Turning Points of History in 1998, speaking on his role in the coup d’état in Guatemala in 1954 that:

[“We had gotten the okay from Cardinal Spellman to go ahead with this… and I wouldn't presume to trace the lines of authority within the Catholic Church… how they get their information they deal with… We've always said in an admiring way that the Jesuits form the greatest intelligence service in the world and always have.""](https://www.youtube.com/watch?v=gtjTBOeAVas&amp;t=104s)

I also [advice you to read about the Jesuit supremacy over all the Intelligence groups and the banking system.](https://saidit.net/s/Jesuits/comments/8fwp/the_jesuits_have_controlled_the_cia_fbi_kgbfsb/) Please support my subs at Saidit.net as well as the site itself and help in any way you can towards a nationalist change: 



https://www.reddit.com/r/conspiracy/comments/soy3ko/meta_the_jesuit_technocracy_needs_to_be_stopped/




https://www.reddit.com/r/conspiracy/comments/qkw39o/meta_the_conspiracy_community_has_to_take_action/"
2022-03-29 21:08:47,moderatepolitics,https://old.reddit.com/r/moderatepolitics/comments/tqhx6w/why_us_population_growth_is_collapsing/i2m7ddj/,"Thank you. It’s funny how people assume so much about strangers. I’m a science teacher, and I explain to ~150 students a year the dangers of climate change, and I encourage them to be active in fighting it. I’ve changed a lot of hearts and kept good students moving in the right direction. So, even though my 3 kids are pretty young, I’m confident they’ll be a net positive in the world. I don’t expect them to be the single solution, but I am sure that they will help."
2022-03-19 05:36:16,alberta,https://old.reddit.com/r/alberta/comments/tgs89n/ba2_subvariant_could_cause_albertas_6th_wave_by/i190rl1/,"So how are they going to manage the next crisis?  Another pandemic, climate change...?"
2022-06-09 12:19:04,collapse,https://old.reddit.com/r/collapse/comments/v87d15/antarcticas_riskiest_glacier_is_under_assault/ibq23l5/,"You could die tomorrow from a car accident and even if the world carries on until the year 2100 like many articles on climate change like to pretend, you will die of old age.

None of us born on this planet were destined to live forever, so make the best life you can and when the end comes face it with dignity and acceptance knowing you lived the best life you could while you were still alive."
2022-02-27 11:36:09,germany,https://old.reddit.com/r/germany/comments/t2liv0/germany_just_announced_it_will_put_over_2_of_its/hymtsy6/,"I mean. I am pleased with the signal and with the new German government kind of starting to catch up with all the crap happening. They were slow to adjust though as one concession to their behavior I must say of all the things the talked, negotiated and planned to do following Merkel, a war in Europe was not one of them.

That said the obvious worry is that between the economic fallout of a pandemic, investions for climate change reforms, general global economic crisis and now a war is where all the money is coming from to deal with even half of it?

Only hope here is that the new chancellor was the previous finance minister so hopefully knows how to handle the money streams.

&amp;#x200B;

The second thing whether the German armed forces can even manage a budget increase effectively though at least having hard limits removed hopefully allows to be more pragmatic to fix immediate issues like spare parts or ordering bulk supplies for increasing stock piles.

&amp;#x200B;

Besides that it is maybe important to note that one goal is to go beyond 2% of GDP, the 100 billion is planned as a one off special assets fund to be available to the defense budget. Not sure how that calculates with each other."
2022-06-27 15:13:52,publicfreakout,https://old.reddit.com/r/PublicFreakout/comments/vlq5fd/climate_protester_blocks_the_sydney_harbour_tunnel/idxryew/,"&gt; peaceful protests

That's exactly what she did.

&gt; the key is education, discussions

In an ideal world, yes. In reality, this reality, no. The difficulty of addressing climate change has to in a large part been down to the successful disinformation campaigns waged by fossil fuel interests."
2022-06-07 18:12:34,askreddit,https://old.reddit.com/r/AskReddit/comments/v7390p/what_are_some_unethical_business_tactics_being/ibijqxg/,"Honestly, I feel like meat and oil have been priced artificially low for what it costs (monetarily, and to society) to produce it. 

These are not things we should be subsidizing, they're things we should be taxing the hell out of to keep the costs high and discourage use.

Edit: Downvote if you need to, I know it fucking sucks ass to fill your tank and get chicken right now. But we're kind of literally destroying our planet and climate with these things, and the American idea of ""expensive"" is what a whole lot of countries have already been paying since forever...and what a coincidence, those are the same countries everybody points to in terms of policies we should emulate on pretty much every other issue.

Edit 2: We have no hope whatsoever of doing anything at all about climate change, if we can't handle 5.50 a gallon at the pump."
2022-04-29 16:29:35,therightcantmeme,https://old.reddit.com/r/TheRightCantMeme/comments/uemm9e/qanon_john_with_a_galaxy_brained_theory/i6omfrx/,"Satan party would not claim they love Jesus and let people go homeless, be under crushing debt, let people die with no healthcare and remove all social safely nets. Pollute the Earth, cause climate change, worship money, hate everyone outside the tribe, colonize the locals and oppress them plus stealing all the resources.

Lie to liberals as they is gaslighted and propagandized to death and claim commies and socialists is the devil and have no morals. They cant see they is the sinners they so call preach about."
2022-01-05 07:30:24,politicaldiscussion,https://old.reddit.com/r/PoliticalDiscussion/comments/rw9o4g/if_congress_fails_to_pass_anything_related_to/hrbs48a/,What specific laws have been passed and what measurable impact have they had on climate change?
2022-04-14 22:49:48,askreddit,https://old.reddit.com/r/AskReddit/comments/u3kvsx/serious_what_are_some_of_the_most_common_dark/i4rg538/,"Your lifestyle probably contributes to climate change through the purchases, actions, and choices you make. Blaming corporations for supplying you is just a cop out."
2022-08-11 04:17:55,technology,https://old.reddit.com/r/technology/comments/wl3wkp/jeff_bezos_bill_gates_and_other_billionaires_are/ijtf0eu/,"I know you mean well but that's the premise of ""Don't look up"". The minerals on the asteroid are going to help the economy and could end world hunger and bring worldwide peace.

Ah, you mean the billionaires said that the minerals can revert climate change? How that will stop Brazil's deforestation? How's that going to revert Ocean's pollution and stop killing algae?

It might reduce fossil fuel consumption which is a technology that is already obsolete and being replaced anyways."
2022-05-23 17:30:47,finance,https://old.reddit.com/r/finance/comments/uw0o3n/hsbc_suspends_banker_over_nut_job_climate/i9pgaax/,Do you willingly ignore the studies into the economic cost of climate change? There is a very real financial impact to climate change which countless studies have shown time and again.
2022-02-02 03:34:06,economics,https://old.reddit.com/r/Economics/comments/si0xzl/suburban_sprawl_is_weighing_on_the_us_economy/hv89kc9/,"Sure crime could go up, and house values could go down. But those things could happen for any reason a previous house had people selling and fighting the establishment of a off road park for those same fears. Not jumping in to help fight the developer doesn't mean that I'm out there advocating for for it to get built either. 

In the end though I honestly don't see how it's going to affect our values. It's a gated community, in what's currently a very poor county that's slowly becoming gentrified. It's also the last community that will have salt water access. Addition it is zoned for the only blue ribbon school in the area. If anything I expect climate change and the housing market in general to be much more likely to ruin housing prices in the development long term."
2022-07-19 06:59:23,berlin,https://old.reddit.com/r/berlin/comments/w23hik/til_that_berlin_is_building_a_massive_green_space/igqycje/,We used to call them parks … before the „climate change“ propaganda of course
2022-03-04 19:23:59,walkaway,https://old.reddit.com/r/walkaway/comments/t6q1i1/why_did_republicans_vote_against_the_veteran/hzcr2ay/,They try to sneak some kind of climate change nonsense in every single bill they pass they're obsessed with it.
2022-03-21 17:42:15,sardonicast,https://old.reddit.com/r/Sardonicast/comments/tj73zq/dont_look_up_has_won_the_writers_guild_award_for/i1k13qs/,"It’s so weird, because lots of people claim to hate on it for not being subtle or being too political and all that, but then you also remember half the country doesn’t believe in climate change."
2022-01-04 20:45:07,asheville,https://old.reddit.com/r/asheville/comments/rv7drh/rasheville_weekly_free_talk_thread/hr9dx0w/,"I thought the film wasn't nihilistic enough. And felt dystopian enough that I didn't really feel like it represented reality in the way a movie like, say, Gaslands did. Interesting to compare this movie to *Wag the Dog*. All in all, I feel like I'm taking climate stuff pretty seriously in my personal life. Mostly bike, going vegan, don't take many plane flights, limit electricity and water use. I see a lot of progress culturally towards climate solutions in my short life. In short, I'm a perpetual optimist.

I guess the film was weird to me; in a Sort of gatekeep-ish sort of way I was thinking ""really? This celebrity-driven media critique that barely actually touches on actual issues is the thing that will get you invested in climate change activism/whatever crisis you relate to?"
2022-04-06 01:57:02,bogleheads,https://old.reddit.com/r/Bogleheads/comments/tx9vzf/any_other_bogleheads_believe_capitalism_is/i3kmg7d/,"Basically what Europe and the Netherlands do.

Hilarious when dumb americans act like the only two choices are extreme capitalism or fucking mayhem/death. 

The world is fucked. Humans will never come together to make the changes we need to reverse or even slow down climate change or the speeding impending end of humanity.

Which means actually that we can all just relax and just keep going about our business, doing the dumb shit we do because the only people really getting fucked are your kids and grandkids and so on but who gives a fuck about them as long as we don’t have to deal with it.

Smarter people are seeing there’s no point to breeding more humans."
2022-01-15 10:28:27,environment,https://old.reddit.com/r/environment/comments/s4g4jc/oxford_university_veganism_is_single_biggest_way/hsr0yi8/,"But some of those corporations are producing meat. Obviously waiting on government or businesses to act is useless, they're seemingly happy to let the world burn. So we need to find something we can do ourselves. Well, if we all stop eating meat, then that wipes off a few of those polluting corporations doesn't it. The thing is, meat production with a global population the size we have can never be sustainable, its inherently bad for the environment. So with this ""100 corporations produce all the carbon emissions"" thing, it suggests these companies need to fix their ways. So yeah, fossil fuel companies need to start producing green energy, mining companies need to stop polluting the environment. But meat producers can't clean up their ways enough to stop climate change, the only solution is for them to scale down massively and fir many of them to just stop doing it all together."
2022-07-21 10:13:41,greentext,https://old.reddit.com/r/greentext/comments/w41816/anon_is_based/ih15qd9/,"You're right, diversity is key. We're going to run out of oil one day, it's just going to happen, probably in our lifetimes, not in the ancient politician's lifetimes.

If you have a combo of nuclear, solar, wind, hydro, etc. then if a disaster happens you have contingencies. 

Smog from pollution gets bad enough to block the sun? Solar is screwed but nuclear, wind, and hydro still work. 

Drought causes a lake to dry up (cough hoover dam)? Hydro is screwed but your solar is probably doing excellent at the same time. 

In a sparsely populated or poor region where nuclear is too costly to be feasible? Local solar, wind, and hydro.

Wind patterns change from climate change? Your wind is dead, (probably hydro too) but nuclear and solar are great. 

We eventually run out of uranium or the oil lobby gets more anti-nuclear legislation passed (they were behind the funding of it decades ago)? You have solar, wind, hydro to fall back on.

Densely populated area too big for solar, wind, and hydro? Nuclear or hell use plants that burn the garbage and capture the waste.

Diversification is good, even if one tech is ""better"" than the rest, they all have their downfalls."
2022-02-01 20:09:10,hermancainaward,https://old.reddit.com/r/HermanCainAward/comments/shvy26/update_subject_harleyoakleygoatee5637_has/hv6er29/,"War against expertise has been in the making for a while now. Koch funded. Fox News propagated. First truly cemented by climate change denial. So it’s easy for them to now rail against doctors. Since, doctors/ CDC  are trying to change peoples lives (in order to save them). These are the machines that Murdoch and the Koch family have been priming for the last 30 years.
  
Let’s be honest. These right wingers are all cannon fodder cucks for the corporatist white nationalist authoritarian GOP. That’s a sensationalized mouth full, but that’s what we’re seeing. These people will lay down their lives now for the Trumps, the Mercers, Koch’s, Murdoch family (thank you Australia, you fuckers) etc etc"
