date,subreddit.name,permalink,text
2022-08-13 13:26:20,mealtimevideos,https://old.reddit.com/r/mealtimevideos/comments/wnbkxz/hank_green_the_biggest_climate_deal_in_history/ik4j9li/,"IRS funding in a climate change bill? 

Weird."
2022-05-22 23:10:00,california,https://old.reddit.com/r/California/comments/uvgpeg/california_is_about_to_begin_the_nations_largest/i9mbvkr/,There are plenty of man-made and natural reservoirs and lakes where water is stored. The drought is caused by climate change and the way we misue our water. The idea that we should be building dams is a distraction campaign by California Republicans against the high speed rail that probably could've been finished and operational already if not for them.
2022-01-03 19:15:55,kurdistan,https://old.reddit.com/r/kurdistan/comments/run6qq/idk_why_but_a_new_day_means_a_new_map_so_here_i/hr3y82s/,"Whoah very blessed that you are able to visit Kurdistan. But yea of course you are from Nashville, basically Little Kurdistan in the States😂. To be honest, I am planning just to fly to Kurdistan at 18~19 years old, got a few years to wait. Living in Germany is pretty much okay. There is technically nothing you could complain about, except the weather, especially if you live in the very west of Germany (the climate is too maritime plus it is raining all day, but okay the weather is just the weather, nobody can change it). Even though I am kinda tired living in Germany and see to maybe emigrate to another country in the far future. But yea if you have friends you hang up with outside or also as an adult a well-payed job, you lead an awesome life in Germany. Besides, I like the fact that I can casually visit Belgium or the Netherlands (because of that Schengen agreement). I could just now head to our city's main station and drive one hour to some cities of the Netherlands such as Venlo, Arnhem or Nijmegen."
2022-07-21 15:25:55,anarcho_capitalism,https://old.reddit.com/r/Anarcho_Capitalism/comments/w4fnqq/man_it_sure_is_hot_in_the_middle_of_july_can_you/ih27vyr/,"The point is that *everything proves climate change*.  Got colder temperatures?  Climate change.  Hotter temperatures?  Climate change.

You know what's even weirder though?  When temperatures remain rather consistent like they did for about a decade 15 years ago.  That's *definitely* a departure from the norm.  Climate change!

When you're dealing with non-falsifiable hypothesis, you're not dealing with science.  You're dealing with religion."
2022-04-24 13:41:28,london,https://old.reddit.com/r/london/comments/uaho71/london_climate_activists_boast_of_biggest_night/i5zzfvr/,"A lot of the people I knew who supported more action on climate change but weren’t doing much about it were really inspired by XR protests and went much more fully into it (going vegan, flying less, going to protests). A lot of those people got disillusioned by XR but remain much more thoughtful about their environmental impact than before XR kicked off hard"
2022-07-02 21:14:41,oddlyterrifying,https://old.reddit.com/r/oddlyterrifying/comments/vpmjdb/lake_mead_1983_vs_2021/iemexl7/,I though water levels were rising due to climate change?
2022-07-11 03:03:51,futurology,https://old.reddit.com/r/Futurology/comments/vvxaf6/mit_scientists_think_theyve_discovered_how_to/ifodzfj/,"Yes, this is the whole idea behind geoengineering. Doing this will not fully reverse climate change. The article headline is bull."
2022-02-08 12:07:16,collapse,https://old.reddit.com/r/collapse/comments/sndzak/ideas_for_better_forms_of_government/hw2m7n3/,"Ok I will just point our the flaws in your selected methods, I don't have any solutions, but I can critique those put forward.

Lottacracy - The issue with the random selection you will either end up with people who are completely unsuited for the role, or with unsavory (demagogues, tankies, fascists, religious fundamentalists, etc) peoples gaining a position, if it is truly random you will get a lot of the former and a bit of the latter. Some have floated the idea of having a strong civil service to ""advise"" those randomly selected, but that runs into the issue of the civil service controlling the state which is in essence the creation of a new unelected ruling class.

Direct Democracy - One thing, the proxy you trust as you say is almost on the rail in the idea of representative democracy. Direct democracy has its uses in some areas like deciding key national issues like what Ireland does with its constitution, Switzerland does in its Cantons, and various countries did with EU and NATO membership. One issue is with the sheer amount of voting you would get voter apathy, people would no longer engage on the smaller issues, with only the dedicated (good or bad) voting people in. Another issue is demagoguery, a direct vote system would allow people to vote with desires, all you need is 50%+1 of the population to vote for you, which is surprisingly easy for a demagogue politician, a tyranny of the majority if you will, populism in itself is not good or bad but merely a reflection on the views of the people. On the contrary if you have multiple choice direct democratic choices instead of binary choices, you can have tyranny of the minority where a small minority of people wield disproportionate amount of power by forming a powerful voting bloc, sound familiar doesn't it. The last one is how do you take money out of it, people promise things, tax cuts, wage boosts, they offer to be tough on crime, to open/tighten the borders, they offer to be liberal/conservative. Money is just the vehicle by which people propagate these beliefs.

Algorithmic Government - I think the same problem, who decides what is the hierarchy of values that are coded in, runs into the same problem with direct democracy. Who defines the common good, who defines how the judiciary evaluates things. Such a systems might appear very fair but its clear how easily it could be subverted by the tyranny of the majority. 

Ultimately here is the thing, modern governments are designed to inhibit and slowdown change, but not out of hand reject it, these is not for the peoples benefit but for the systems own sake. Things are too easy to backfire, mess up, or otherwise spiral out of control when you hand over such an amount of power and change to people, even for their own benefit. There is no silver bullet to the global problems with governance, and no systems that can replace our representative democracies. They are flawed, and perhaps their deadliest flaw so far was inhibiting and slowing down change in regards to climate change, this is a system feature not a bug though."
2022-07-30 14:39:53,politics,https://old.reddit.com/r/politics/comments/wbwfmv/the_gas_industry_is_pumping_money_into_a_tiny/ii9ggcw/,"Over here in Germany we see similar stuff as well. Fighters for less pollution and tackling climate change against fossil fuel interests and corruption in politics.

Every win you get on environment is a win for us too, every win we get is one for you too. I hope we all can achieve a lot of significant steps very soon, climate and pollution are getting worse and worse."
2022-05-24 06:29:24,askanaustralian,https://old.reddit.com/r/AskAnAustralian/comments/uwcbg6/conservative_leaning_members_of_australia_how_do/i9s1mz0/,"Lifelong Liberal voter here. Not surprised in the least but very disappointed in where the party has headed and where it appears to want to head afterwards (further right). 

This is first election where I genuinely didn’t know who to vote for even up until the day. The Liberal party, has completely abandoned the principles the party was founded on. We weren’t meant to be a party of religious nut jobs who abandon logic and sound economic principles. Morrison (I refuse to call him Scomo, how cringy) is by far and away the worst Prime Minister this country has seen (even worse than Rudd) who failed the leadership test time and time again. I couldn’t in good conscience vote for that. I wasn’t in a Teal seat but a lot of them were essentially moderate liberals who have could see the failures of a party that they historically have voted for. 

What I’ve seen since then is this lurch towards the right to move away from “woke left politics”. Climate change policy isn’t about wokeness IMHO. Do I think Climate a change is real? Yes, because I’m a logical thinking human who believes that’s what the data and science it telling us. Should we do something about it? Absolutely. Should we cut off our nose off to achieve our goals? No I don’t think so. Something has to be done and we have completely missed an opportunity to become a world leader in technological solutions to the problem."
2022-03-23 15:56:32,worldnews,https://old.reddit.com/r/worldnews/comments/tktmqj/putins_foreign_minister_says_freezing_russias/i1t55me/,"&gt;It's like treating a tumor with ibuprofen.

Or treating climate change with recycling and electric cars."
2022-04-08 04:28:25,hasan_piker,https://old.reddit.com/r/Hasan_Piker/comments/tys0vr/life_advice_from_an_unwell_man/i3uy71h/,"You deserve to not be yelled nor should you be given insults. 

However, let me reiterate - human *competition* has become, let’s not say the root cause, but a main influence on the decay and destruction of humanity.

Human innovation has been a product of competition between businesses, sure. One excellent example for your argument is this:

Around the peak of the Cold War, the American government heard tell of the highly experimental procedures the Russian medical field was doing. They were threatened by this, and decided to compete by funding more out-there medical researches.

One such research was conducted by Doctor Robert White, who received funding for his head transplant research. His findings, while have not lead to true brain/head/spine/nervous system transplant, have produced many techniques that are still used today to treat concussions and brain injury.

However, competition has also lead to possibly the end of our species as we know it. Oil Companies who have competed to drain the planet of its resources, have scarred and ruined the Earth for the foreseeable future. In their competition for profits, they lobbied in governments to remove any restrictions or regulations on oil rigs and their companies. In their race to see who could fatten their pockets, they’ve ruined generations of people. Because of them, the question is no longer “What does the future hold for me?”, it is now “What future do I have left?”.

The collective knowledge of human innovation and advancement? We can still have that *with* cooperation.

Leave competition for the academics, the athletics and the artists. In terms of our species as a whole, we must shed this belief that competition is necessary for our survival. We no longer need to compete over food, land, home, relationships - we are, out of almost every other animal out there, the most social creatures on this planet. We depend on cooperation and codependence to survive. That’s what’s put us on top.

The very concept of nations (which I strongly argue against their very existence) and the competition they showcase against one another *have* positives. But their net negative against our species (war, death, climate change, racism, xenophobia) outweigh whatever positives we can dig up.

For us humans, cooperation is key. With it, we could explore the stars, end diseases, hell we could beat entropy itself if we got our heads out of our asses and helped one another. Competition can’t do that because, at this point, human competition has lead to humanity’s greatest problems.

Insults to you and yours are undeserving and uncalled for. To my knowledge, you’ve said nothing hateful or stupid. If you did, I wouldn’t hesitate to mock you because there is no arguing hateful actions and beliefs. So thank you for at the very least the civility you’ve shown. Please take care and be safe."
2022-08-24 18:55:01,colorado,https://old.reddit.com/r/Colorado/comments/wwqyes/polis_ganahl_address_colorado_water_congress/ilmppc5/,"Well, not to be mean, but she sounds kinda nuts. At a symposium to address a specific set of issues, she just kinda... went off, it sounds like.  


Plus she sounds like every other GOP'er - Day One I'm Gonna Have A Water Plan! What does that even mean? Are you aware of how much effort goes into lining up conservation, irrigation, flood control, basin control, flow control - and I'm not even out of local issues yet, let alone that the Colorado River is a shared resource between states.  


Also, ""I'm going to solve climate change by putting more oil and gas workers back to work.""  


That's one of the main contributing industries to climate change. Smh."
2022-03-01 07:57:26,nextfuckinglevel,https://old.reddit.com/r/nextfuckinglevel/comments/t42nhb/fake_news_manufacturing_something_goes_wrong/hyvzgcl/,"Austria, a climate protest.  First idiots tried to claim it was the government faking covid deaths, now i assume the OP is pretending someone is faking ukrainian deaths,

The only fake is OP

[simple google search Austrian climate change protest fake corpse](https://apnews.com/article/fact-checking-661739618421)"
2022-08-01 01:41:26,self,https://old.reddit.com/r/self/comments/w9ju9i/billionaires_are_all_aholes_there_are_no/iigewje/,"&gt; Giving people credit for doing beneficial things for bad or selfish reasons just gives them tacit permission to be selfish or bad in all areas of their life as long as there is one area we can point to where their broken close is right at least twice a day.

...or we could criticize them for all those other areas of their life?

I don't see how this is worse than giving people tacit permission to be selfish or bad in all areas of their lives as long as they can pretend they had good intentions.

&gt; &gt; People who want to deny that it exists will talk about how the people in these institutions aren't racist

&gt; Yeah but they're wrong is the problem, they're just disingenuous.

Nope, the problem is that institutions can continue to have racially-disparate effects (be institutionally racist) even if no individuals working in them is consciously prejudiced against any particular race. This is the *entire point* of institutional racism as a concept. Like redlining -- a bunch of banks and city planners in the 30's decided how our cities still look today.

&gt; Absolutely not, these things are not equivalent whatsoever...

Because you aren't a billionaire, so your mess is much smaller, for now.

&gt; The mere fact that I've purchased an item produced unethically is not remotely equivalent to having a direct hand in the unethical practices by which that item was made.

How direct a hand are we talking? Does the billionaire CEO tour every factory they use? Are there even viable options that can guarantee zero sweatshop labor? Whereas:

&gt; They're making those choices because it maximizes their wealth and is the difference between the amount of unnecessary luxuries they are capable of buying, when they could simply choose to conduct their business in a different way and buy slightly fewer unnecessary luxuries.

Do you *need* both a computer and a phone?

You're not wrong that this is generally brought up as a smokescreen. But if, say, Gates actually got done the things he claims to want to (fixing climate change, *ending* polio, all of that), yet Microsoft stuck around being Microsoft, I think I'd prefer that to a world where he gives a nice big bonus to everyone who ever worked at Microsoft.

&gt; As a slight side point, from my observations, pretty well no business is actually in this sort of situation—where they absolutely must be a brutal cutthroat piece of shit in order to survive.

Yep, hard agree on that one."
2022-04-08 02:17:08,climate,https://old.reddit.com/r/climate/comments/tysfa7/how_significant_is_the_aerosol_masking_effect_and/i3ui9x3/,"Aerosol masking effect is a term invented by Conservative Think Tanks to propagate climate change denial.  Google the sources of funding for the websites that use that term.  You'll find that they are all funded by Republican Oil Money.  

https://skepticalscience.com/aerosols-global-warming.htm"
2022-01-04 12:42:25,collapse,https://old.reddit.com/r/collapse/comments/rvpbme/i_feel_ashamed_to_be_an_american/hr7g9g5/,"You can move to find healthcare, but you can't move anywhere to avoid climate change. Wish you well."
2022-06-09 22:03:35,unexpected,https://old.reddit.com/r/Unexpected/comments/v8jn54/at_this_level_its_art/ibs8xbe/,"""If you don't contribute to climate change you aren't a man"" 

Yeah okay.  The guy in the video is great lol ""don't encourage him"""
2022-05-20 04:00:59,askanaustralian,https://old.reddit.com/r/AskAnAustralian/comments/utjjio/election_day_is_tomorrow_whats_the_main_issue/i9adsf4/,"I'm throwing equal weighted importance to ICAC and climate change. Both are incompatible with the Liberals.

I live in North Sydney though, and the independent candidate is very likely to get in, and supports my position.

I've grown up in a Labor family, which doesn't usually bode well in my area (I've lived in Mitchell, Warringah, North Sydney and Wentworth - all usually very safe Liberal seats), but I've got a bit of faith that the ""teal independents"" can make some giant douches very uncomfortable tomorrow."
2022-02-04 22:54:01,canada,https://old.reddit.com/r/canada/comments/skei0r/bc_youtuber_faces_charges_over_30_day_survival/hvmjkqv/,"Were not even close to where we need to be. Carbon emissions have held steady for a while now. We need to shrink our populations and consume much less than were consuming now to even make a dent.

https://www.canada.ca/en/environment-climate-change/services/environmental-indicators/greenhouse-gas-emissions.html

Per capita, were one of the worst polluters on Earth. And we don't even make most of our own stuff here."
2022-02-10 15:44:20,climateskeptics,https://old.reddit.com/r/climateskeptics/comments/sok313/germany_is_a_mental_asylum_which_only_lacks_a_roof/hwdn9x1/,Sounds like all the necessary qualifications to dispute human caused climate change 😂
2022-01-27 18:28:01,damnthatsinteresting,https://old.reddit.com/r/Damnthatsinteresting/comments/se2n0n/spread_love_not_hate/hugzqoe/,"[right climate changes doesn't exist ](https://www.independent.co.uk/climate-change/news/joe-rogan-jordan-peterson-spotify-b2001368.html) or his whole spreading of misinformation.

Gtfo you dunce."
2022-07-04 13:34:17,loveislandtv,https://old.reddit.com/r/LoveIslandTV/comments/vqs4j6/nonuk_viewers_what_is_your_favorite_commercial/ieted4w/,"&gt;Even the conservative government emphasises sustainability, although YMMV on whether or not that's just lip service. But environmental issues aren't a ideological battleground in the UK - the climate change denial of Republicans is simply not done in the UK."
2022-08-18 09:17:59,climate,https://old.reddit.com/r/climate/comments/wr8owe/we_can_thank_green_new_dealers_for_the_inflation/ikruuzi/,"The Sunrise movement had a dimension that transcended the current US government. They pushed for the Green New Deal, a very bold proposal which arguably didn’t bring much tangible solutions (but I’d still like to see sources). What the movement did was move the political needle on Climate Issues in the US. They made it non negotiable for the Democrats to do something, hence the IRA. But I think ultimately, the Sunrise Movement also had a dimension about political change. They recognized that the US’s political system is rigged and wanted to do something about it. I don’t think we can say anything came out of the need for political change but it again might have changed the minds of people with actual political change happening several years in the future. Still, I have a lot of respect for Sunrise movement and its participants."
2022-03-25 08:53:47,worldnews,https://old.reddit.com/r/worldnews/comments/tnhipn/cheap_russian_oil_is_heading_to_china_and_india/i21k4fc/,"Well, they are the first to go with climate change. In the long run they hurt themselves."
2022-04-13 21:24:03,architecture,https://old.reddit.com/r/architecture/comments/u2x0v6/i_feel_that_professors_dont_understand_me_in/i4ma3oy/,"There's a bar in Longyearbyen called ""Svalbar Pub."" If you're there on a site visit, make sure you ask for a martini. Bartender didn't know what one was until we showed up some years back to tour the seed vault. You can test it out our mentoring and see if they've gotten any better. 

I'm wondering if your professors are on to something and you just haven't accepted it yet. Maybe they aren't attacking your position with coming from a more technical aspect, but maybe they're trying to get you to understand that you can expand your vision to incorporate more of what architecture is. I haven't seen mention yet of the program for the building or how you're dealing with a building in Svalbard. It sounds like maybe you want it to be environmentally sensitive to the land, what does that mean besides not breaking permafrost? Is your museum mobile? Is it a machine for following the sun? (BTW, after typing that, I feel like you have to see ""Where'd you go Bernadette"" with Cate Blanchette. )

The whole nature of a building as a repository for the sun in a distant, cold land sounds totally poetic and romantic doesn't it? I mean, its kind of a setup to test your creativity with the deeper language of architecture. Do you see it? 

First the sun museum program  -how are you addressing the ""acquisition, conservation, study, exhibition, and educational interpretation of \[the Sun\]""? Think of the mythical cultural ties.  That brings up loads of poetic sculptural, mythical whatchamcallits that seem to tie directly to engineering. I mean, how much of engineering is specifically driven to counter effects of thermal expansion from.....the sun? How much of a museum is typically about controlling light and specifically UV rays from the Sun. (Reference Calatrava's Milwaukee Art Museum and he's also an engineer and Louis Kahn's Kimball Art Museum ceiling ) Is it the perfect way for you to tie your engineering mind with the physical reality of a cold climate and the expansion of materials/building components as they warm? Perhaps. Is it the ideal project to show the melting of the ice caps due to climate change and the impact to the built environment? How many elements in building are only available because of stars and the cosmos? What about the aurora borealis visible in Svalbard due to the sun. 

Second, the site your profs set you up with is dangerous (look up polar bear attacks and how they skin unsuspecting tourists alive before eating them) the desolate cold and the effects of a location with and without sun for extended periods of time, melting ice, glaciers, ice breaking boats. The hotel we stayed in had no curtains to block the midnight sun, only red transparent blinds. The whole room glowed all night long in this unworldly red. I still don't know what that was about but obviously something related to how people react to long periods there. There's a psychological component to, once again, the sun in Svalbard.

Anyway, architecture sucks and school is the most freedom you'll probably ever experience in it. Do a couple projects with dewpoint insulation analyses and roofing details. You'll do super well professionally with that, but use the time to expand your mind and  conceptions of what architecture entails."
2022-07-16 14:54:15,environment,https://old.reddit.com/r/environment/comments/w03za4/biden_concedes_defeat_on_climate_bill_as_manchin/igefwgi/,Are you insinuating that the Republicans did ANYTHING for climate change? The same party that pulled us OUT of the Paris Accords?
2022-06-19 02:00:16,louderwithcrowder,https://old.reddit.com/r/LouderWithCrowder/comments/vfhc6p/shouldve_stayed_at_the_kitchen_table/icwe6x7/,That damned climate change strikes again!
2022-05-04 09:29:15,askmen,https://old.reddit.com/r/AskMen/comments/uhtoq8/whats_something_you_think_everyone_should_try/i79sy9f/,"I think everyone should try at least once looking at the [NASA data for global average surface temperature](https://data.giss.nasa.gov/gistemp/tabledata_v4/GLB.Ts+dSST.txt) by year, and compare the most recently completed calendar year (2021) to prior years (e.g., 2020, 2019, 2018, 2017, 2016, 2015).

I am not talking about giving it some cursory glance and concluding that it says what you think it does without thinking. I am talking about actually doing the experiment. [Look at the data](https://data.giss.nasa.gov/gistemp/tabledata_v4/GLB.Ts+dSST.txt), and compare 2021 to 2020. Which year was hotter. Now compare 2021 to 2019. Which year was hotter. Now 2021 to 2018. Which year was hotter. Now 2021 versus 2017. Which year was hotter. Now 2021 versus 2016. Which one was hotter?

The first step will be in identifying the yearly average for year 2021. You can do that, right? I mean, you understand science, right? You know stuff about climate change, right? So surely you'll be able to figure out which number in the data table represents the year 2021 on average, right?

Now, I realize that you are all incompetent buffoons with a political axe to grind, and don't care what the, you know, actual scientific data say. But you ought to at least **once in your life** [try it](https://data.giss.nasa.gov/gistemp/tabledata_v4/GLB.Ts+dSST.txt)."
2022-07-24 12:07:01,climate,https://old.reddit.com/r/climate/comments/w694hw/rightwing_media_downplay_climate_change_amid/ihftkwy/,This is a non argument and literally just highlights your misunderstanding of climate change.
