title,date,text,URL,Party,Country,Year,parlgov_party_id
Greens call for disability to be placed at the heart of new Labour government,2024-07-17,"17 July 2024 / 17 July 2024 by Green PartyResponding to the news that there will be no dedicated disability minister in government, Mags Lewis, Green Party Spokesperson for Disability said,“Whilst it is to be welcomed that the Government finally announced the new Disability Minister late last week, it is a huge concern to see the role has been added to, or amalgamated with, the Minister for Social Security.“This means that there will be no dedicated disability minister in government.“Sir Stephen Timms will be the Secretary of State (Minister for Social Security and Disability), but with disability a notoriously neglected area and with us being shamefully under-represented in the House of Commons and indeed every area of government, what message does this send to the 16 million disabled people in the UK?“Whilst disability is the responsibility of every minister and disability crosses all areas of government, such has health, DWP and social services, we need a minister with the time, focus and authority to champion the transformational change desperately needed and to see us not as a problem, but as an asset.“Waiting over a week for a minister to be appointed, and for it to be added onto another department, sends a clear message to disabled communities that we are not a priority.“It is only by having a dedicated and high profile minister with a cross government brief, will we see any positive change in structures and the dismal position of many disabled people in the UK.”Promoted by Chris Williams on behalf of The Green Party, both at PO Box 78066, London, SE16 9GQ",https://greenparty.org.uk/2024/07/17/greens-call-for-disability-to-be-placed-at-the-heart-of-new-labour-government/,Green Party,UK,2024,467
Equalising capital gains tax could pay for lifting the two-child benefit cap many times,2024-07-17,"17 July 2024 / 17 July 2024 by Green PartyThe Green Party is today arguing that hundreds of thousands of children can be lifted out of poverty if Labour committed to equalising capital gains tax to pay to scrap the two-child benefit cap. The four newly elected Green MPs, will be proposing a reasoned amendment to the King’s Speech that includes the scrapping of the two-child benefit.The IFS estimates that the cap will impact 2.63 million children by the end of this parliament and that scrapping the cap would cost in the region of £3.4billion – before taking into account the wider economic impact of poverty on health and welfare systems. In their recent manifesto, the Green Party estimated that making Capital Gains Tax fairer could raise £16bn, a move that would impact less than 2% of income taxpayers [2]. This £16bn figure is supported by research conducted by Arun Advani, a tax expert at the University of Warwick, who estimated that equalising CGT and income tax rates would raise £16.7bn a year [3].Green MPs will tomorrow propose an amendment to propose the government scraps the two-child benefit cap. Green Party Co-Leader, Carla Denyer MP, speaking on behalf of the Green group of MPs said,“I think Labour are serious when they say they want to change the country. But the change they are looking to achieve will always be hamstrung for as long as they limit their own potential to raise additional revenue to spend on frontline services. The impact of this approach is already clear. Every day we have children going hungry, unable to concentrate in school or struggling to ascertain even the very basics – this is the real world impact of child poverty.  And so today we’re offering Labour a positive fairer taxation that will allow them to redistribute money from some of the wealthiest to some of the very poorest. This is a political choice that they must now make.”The IFS looked at the disparity of how the two-child benefit cap affects different families, and noted particularly the figures relating to British-Pakistani and British-Bangladeshi children saying “We estimate that 43% of children in households with one adult of Bangladeshi or Pakistani origin (400,000 children) would be affected by the policy when fully rolled out, compared with 17% of children in other households (2.4 million children).”Commenting, Green Party Work, Employment and Social Security Spokesperson, Prof Catherine Rowett said, “Scrapping the two-child benefit cap is a moral and practical imperative. It is a matter of social, economic and racial justice. Today we have outlined one way that Labour, if they had the political will, could choose to help millions of children. And child poverty blights lives and costs millions, as generations of children are condemned to lower achievement and a lifetime of poor health. When they say there is no money, remember this is a political choice – they’re ignoring the political, social and economic costs of keeping children in poverty.”Promoted by Chris Williams on behalf of The Green Party, both at PO Box 78066, London, SE16 9GQ",https://greenparty.org.uk/2024/07/17/equalising-capital-gains-tax-could-pay-for-lifting-the-two-child-benefit-cap-many-times/,Green Party,UK,2024,467
Southgate’s legacy is “one that restored a sense of real hope in our national psyche”,2024-07-16,"16 July 2024 by Green PartyResponding to the resignation of England Manager, Gareth Southgate, Green Party Co-Leader, Adrian Ramsay, took to X (formerly Twitter) to say:“Gareth Southgate has modelled a new form of national leadership that puts kindness and compassion at the heart of all we do.His legacy will be one not only of extraordinary sporting achievements having secured two finals, but also one that restored a sense of real hope in our national psyche.I wish him all the very best in what he goes onto next.”Promoted by Chris Williams on behalf of The Green Party, both at PO Box 78066, London, SE16 9GQ",https://greenparty.org.uk/2024/07/16/southgates-legacy-is-one-that-restored-a-sense-of-real-hope-in-our-national-psyche/,Green Party,UK,2024,467
“mired in scandal and controversy since day one” – Green Party responds to Welsh First Minister’s resignation,2024-07-16,"16 July 2024 by Green PartyResponding to the news that the Welsh First Minister, Vaughan Gething, has resigned, Wales Green Party Leader, Anthony Slaughter said, “After over three months of chaos at the heart of Welsh Government the news that Vaughan Gething has finally resigned following the resignation of four ministers this morning is to be welcomed, but questions must be asked as to why this situation was tolerated for so long, damaging and undermining devolution and our democracy.“At a time when Wales faces multiple crises, not least the ongoing situation at Port Talbot, there has been an absence of any real and meaningful direction from a government too busy squabbling amongst itself.“The First Minister has been mired in scandal and controversy since day one of his appointment and his continuous arrogant dismissal of any questions reflects the complacency at the heart of a Welsh Labour Government that does not welcome scrutiny.“This highlights the need for new voices in the Senedd, which is why we are determined to get elected Green representation at the Senedd in 2026, Green MS’s who will hold the government to account, demanding transparency and proper scrutiny.“It’s time for the chaos in Cardiff Bay to stop. Wales deserves better.”Promoted by Chris Williams on behalf of The Green Party, both at PO Box 78066, London, SE16 9GQ",https://greenparty.org.uk/2024/07/16/mired-in-scandal-and-controversy-since-day-one-green-party-responds-to-welsh-first-ministers-resignation/,Green Party,UK,2024,467
Green Party calls for reinstatement of Dubs refugee scheme,2024-07-12,"12 July 2024 / 12 July 2024 by Andrew BellFollowing the tragic death of four more people in the channel, Green Party Migration and Refugee Spokesperson, Benali Hamdache, said:“The loss of life is a tragedy and acts as stark reminder why we need safe and legal routes for those seeking asylum.“Today The Green Party is reiterating our call to reinstate the Dubs refugee scheme that allowed unaccompanied child refugees with family connections to the UK to settle here.“This is absolutely the first step that Labour could take. In 2017 Yvette Cooper described the closure of the Dubs scheme as “shameful” and we agree it was. And so today we call on her to take immediate action to reinstate this scheme at the earliest possible opportunity.”Promoted by Chris Williams on behalf of The Green Party, both at PO Box 78066, London, SE16 9GQ",https://greenparty.org.uk/2024/07/12/green-party-calls-for-reinstatement-of-dubs-refugee-scheme/,Green Party,UK,2024,467
Banning oil and gas licences: how brave and bold will Labour be?,2024-07-11,"11 July 2024 by Andrew BellIn the wake of unfounded reports that Ed Miliband will announce a ban on new drilling in the North Sea [1], co-leader and MP for Bristol Central, Carla Denyer, has urged the energy secretary to do just that, and “send a clear signal to the fossil fuel industry that they have no future in the UK.” Denyer said:“It didn’t take long for the right wing press to come out waving the banner for the fossil fuel industry together with the usual round of scare stories about a dent to the economy and tax revenues if we don’t continue to burn oil and gas. Those cheerleading for oil and gas corporations must not be allowed to derail us from the path towards a green transition. That is where our future prosperity and thousands of good new jobs lies. We need to seize the opportunities that greening the economy will bring.“This is a test to see how brave and bold Labour will be and whether they will send a clear signal to the fossil fuel industry that they have no future in the UK. Ed Miliband certainly should ban all future licences for new North Sea oil and gas fields, and do so immediately.“The Green Party would like to see him go further by revoking the licence for Rosebank which has the potential for producing around 500 million climate-wrecking barrels of oil. We would also like to see a carbon tax on polluters to help drive the transition to cleaner and cheaper renewable sources of energy.”Promoted by Chris Williams on behalf of The Green Party, both at PO Box 78066, London, SE16 9GQ",https://greenparty.org.uk/2024/07/11/banning-oil-and-gas-licences-how-brave-and-bold-will-labour-be/,Green Party,UK,2024,467
Greens respond to OFWAT price rise,2024-07-11,"11 July 2024 by Paul CorryResponding to the publication of OFWAT’s a draft verdict on water companies’ five-year spending plans and bill increases to 2030, Green Party MP, Sian Berry said:“We’re today calling on Prime Minister Keir Starmer to put all water companies into public hands.“The provision of such a basic human right should not be based on profit.“The idea that water companies will hike bills while so many people are struggling to get to the end of the month is horrific. Meanwhile, some companies, like Thames Water, are still paying shareholder dividends, which is deplorable.“Public ownership is a matter of both social and environmental principle. But, as today’s verdict from OFWAT shows, it is also a pragmatic necessity.“Why not take decisive action and show real leadership by saying that all water companies should be in public hands?“Once this is done, government can invest affordably in the creaking infrastructure without all the harm falling onto our bills, and into our rivers and oceans that are currently being treated as open sewers.”Promoted by Chris Williams on behalf of The Green Party, both at PO Box 78066, London, SE16 9GQ",https://greenparty.org.uk/2024/07/11/greens-respond-to-ofwat-price-rise/,Green Party,UK,2024,467
Green Party MPs arrive at parliament pledging to push the new Labour government to be bolder and better,2024-07-08,"8 July 2024 / 8 July 2024 by Green PartyThe four newly elected Green Party Members of Parliament, Sian Berry MP, Ellie Chowns MP, Adrian Ramsay MP, and Carla Denyer MP, arrived at Parliament today, marking a significant moment in the party’s history after they quadrupled their representation in the Commons at the elections. The MPs pledged to hold the Labour government to account, urging them to adopt bold and necessary changes to improve Britain.In their opening move, the Green Party MPs have laid out a clear and achievable ten-step plan, which they describe as a “litmus test for the direction this government plans to travel.” These steps, the Greens argue, are essential for demonstrating the Labour government’s commitment to serious and progressive change within their first 100 days in office.Ellie Chowns MP commented after their arrival in parliament that “We are here to ensure that the Labour government doesn’t just talk the talk about change but walks the walk. Our ten steps are practical, achievable, and necessary and can all easily be delivered within 100 days with political will. They will stand as a signpost for whether Labour are serious about changing Britain for good. Our message today is that we will be relentless in both holding them to account and driving forward positive good ideas.”The 10 steps the Greens say the new Labour Government must take in its first 100 days:Adrian Ramsay MP and Co-Leader of The Green Party emphasised the importance of these steps, stating, “These are not lofty ideals but practical actions that can be implemented quickly. They will have a real, positive impact on people’s lives and the environment. I am delighted that as we meet to enter parliament Labour have already committed to reversing the de facto ban on onshore wind. Now they must go further and faster still and make solar power mandatory on all suitable new build homes. They can, and they must do this in their first 100 days.”Green Party Co-Leader, Carla Denyer MP added, “We have a clear mandate from our voters to push for these changes. Every one of our record-breaking number of Green votes was one for real hope and real change. We will push Labour every day to make sure we see the transformation of Britain that we are all so desperate to see, that our frontline workers are paid properly, that our public transport is fit for purpose and that we have a foreign policy built for peace not profit.”Sian Berry MP concluded, “Today we carry on the work of Caroline Lucas but with the strength of four times the number of voices in the House of Commons. Today is a new beginning. Greens will work tirelessly to ensure that the Labour government is bolder and does better than its promises. The country needs it to deliver more affordable and comfortable council homes, give local authorities the power to introduce rent controls, and do more to support those struggling every day to get by.”Promoted by Chris Williams on behalf of The Green Party, both at PO Box 78066, London, SE16 9GQ",https://greenparty.org.uk/2024/07/08/green-party-mps-arrive-at-parliament-pledging-to-push-the-new-labour-government-to-be-bolder-and-better/,Green Party,UK,2024,467
"There is a better, fairer, greener way to build the houses we need ",2024-07-08,"8 July 2024 by Paul CorryResponding to Chancellor Rachel Reeves’ speech to investors and developers today, Green Party Co-leader, and Green MP for Waveney Valley, Adrian Ramsay, said:“Labour is right to identify the housing crisis and the need create the infrastructure needed to reach net zero as priorities for the new government.“We will support Labour when it gets it right, and also offer alternatives when Labour is going off track.“There is a better, fairer, greener way to build the houses we need for people.“And there is better, fairer, greener way to create the infrastructure we need to meet the urgent need to shift our economy away from fossil fuels to renewables.“Neither involves writing blank cheques for profit-motivated developers or trampling over the rights of local communities.“Labour should look at our Right Homes, Right Place, Right Price Charter (1).“This sets out how we can build affordable homes to buy and new council housing to rent. These need to be ecologically sustainable homes for the future with good public transport links, and the access to GP surgeries and schools that every community needs to thrive.“These are not the homes being built today, which are out of the reach of too many people and do not come with the services that every community needs.“Labour is right to end the de facto ban on onshore wind, but the new infrastructure that will be required to help us get to net zero as soon as possible, must not run roughshod over local communities.“We need to take people with us as we transition to a new green economy. Green investment done the right way is a win for communities and the planet. That includes community ownership of new renewables.”NOTES TO EDITORSPromoted by Chris Williams on behalf of The Green Party, both at PO Box 78066, London, SE16 9GQ",https://greenparty.org.uk/2024/07/08/there-is-a-better-fairer-greener-way-to-build-the-houses-we-need/,Green Party,UK,2024,467
10 steps Labour must take in the first 100 days to show they’re serious about real change,2024-07-06,"6 July 2024 / 6 July 2024 by Green PartyThe Green Party has laid down the first 10 steps the new Labour government’s must take in their first 100 days to show they’re serious about changing Britain. These steps Greens say will act as a “litmus test for the direction this government plans to travel”.The ten steps that Greens have laid out are clear but easily achievable reforms. They are:Commenting, Green Party Co-Leader and newly elected MP for Bristol Central, Carla Denyer said,“Keir Starmer promised change. And so today we’ve outlined a sketch of what immediate change looks like. It means valuing our frontline NHS workers, taking immediate steps towards lasting peace in Israel and Palestine, turbo-charging the renewables revolution and much more. These are issues where the public is demanding change and they are things this next Labour government could, and should, deliver in their first 100 days.”Adrian Ramsay, Green Party Co-Leader and MP for Waveney Valley, added,“These first actions will act as litmus test for the direction this government plans to travel. Are they serious about defending the environment and restoring public services or are we going to see more managed decline on an already broken system? In the medium-term it is clear that Labour need to be honest about the need to raise more revenue to properly fund the systemic change this country needs. It is within this government’s gift to properly fund the NHS but this is impossible if they refuse to consider introducing a modest wealth tax for the very richest in our society. Budgets are already stretched and if they push them much more I worry the system will snap.”Promoted by Chris Williams on behalf of The Green Party, both at PO Box 78066, London, SE16 9GQ",https://greenparty.org.uk/2024/07/06/10-steps-labour-must-take-in-the-first-100-days-to-show-theyre-serious-about-real-change/,Green Party,UK,2024,467
NHS must be at the top of Labour’s to-do list say Greens,2024-07-06,"6 July 2024 by Green PartyGreen Party Co-Leader, Adrian Ramsay MP, has congratulated Labour on forming a government and welcomed Keir Starmer’s pledge to restore politics to being about public service. Ramsay has however also warned that the NHS is in crisis and that Labour need to “get serious” about finding the funding to nurse the broken NHS back to health. Commenting Ramsay said,“At the top of this new government’s to do list has to be the crisis in the NHS.“We have a new Health Secretary being sent into negotiations with the Junior Doctors with the same stretched budgets.“If they keep stretching these budgets, something will snap.”“Labour need to get serious about funding for our NHS.“There remains a conspiracy of silence around the funding of the NHS that this new government needs to address this.“The Nuffield Trust has already said their current plans will leave NHS funding in a worse state and would represent “an unprecedented slowdown” in NHS financing.“Before the election Greens put a figure of £30bn a year that we thought the NHS needed alongside a £20bn capital fund to fix the crumbling buildings.“Green MPs will push the new government to be bolder on delivering the funding needed to restore our overstretched NHS”Promoted by Chris Williams on behalf of The Green Party, both at PO Box 78066, London, SE16 9GQ",https://greenparty.org.uk/2024/07/06/nhs-must-be-at-the-top-of-labours-to-do-list-say-greens/,Green Party,UK,2024,467
Four MPs: Green Party makes history  ,2024-07-05,"5 July 2024 / 5 July 2024 by Andrew BellThe Green Party has made history by winning four seats in the general election. The party took Bristol Central off Labour, two seats in the former Conservative leaning Waveney Valley and North Herefordshire and retained Brighton Pavilion. The party says that the quadrupling of Green MPs is the result of solid and positive campaigning on the ground in all the target constituencies, a campaign supported by hundreds of volunteers who “relentlessly pounded the streets for months and weeks” in the run up to the general election.Carla Denyer, the new MP for Bristol Central, said:“The Green Party has made history. First and foremost, we say thank you to the voters who have put their trust in us. This is an incredible breakthrough, quadrupling our number of MPs. These victories, together with a doubling of our 2019 vote share to over 7% and the fact we came second in 39 seats in England and Wales, shows clearly that people have embraced the chance to choose real hope and real change right across the country, in both urban and rural settings.“I am so delighted that voters in Bristol Central have chosen me to be their MP. This was a hard-fought battle, and I pay tribute to Thangam Debbonaire for her time as a hard-working MP here.“I love this city. Bristol is different, distinctive and dynamic and I feel deeply honoured that so many voters have chosen me to represent them in parliament.”Adrian Ramsay, who won in the new seat of Waveney Valley said:“This is the first time someone other than a Conservative MP has represented this part of the country. With a Green MP, Mid Suffolk District Council having a Green majority and Greens being elected to councils across the region, the map of East Anglia is being redrawn. Gone is the sea of blue to be replaced by swathes of Green.“I will be an active local MP, focused on representing Waveney Valley while pressing the new government to be bolder on the action needed to restore public services and defend the environment.”Ellie Chowns who also won her seat from the Conservatives in North Herefordshire, said:“It was clear that the Conservatives had become deeply unpopular, but this result had more to do with the Greens’ positive offer, one which looked at how investment in our health, care and dental services, affordable housing as well as our commitment to cleaning up our rivers and addressing the climate and natures crises can improve the lives of everyone.”“Our role now is to challenge the Labour government to be better and we will strive to do that every day.”Sian Berry, who retained Brighton Pavilion, where Greens have held the seat since 2010, said:“I am so delighted that voters in Brighton Pavilion have chosen to keep their city Green, electing a Green MP for the fifth time in a row. I am hugely proud of this city and its desire to challenge the status quo.“It is also fantastic to know that we have quadrupled our number of MPs and that I will be working alongside three amazing colleagues. That’s four times the influence and energy to work constructively with the new Labour government on some of our shared goals while pushing them to be bolder where we think their ambition is lacking. Greens will be pushing the policies for a fairer economy, to mend our broken public services, and for serious action on the climate and nature crises.“We pay tribute to the hundreds of volunteers who came from far and wide and relentlessly pounded the streets for months and weeks in the run up to the general election. Thank you for your incredible support – these results would not have been possible without you.”Promoted by Chris Williams on behalf of The Green Party, both at PO Box 78066, London, SE16 9GQ",https://greenparty.org.uk/2024/07/05/four-mps-green-party-makes-history/,Green Party,UK,2024,467
Sian Berry has WON Brighton Pavilion for the Greens,2024-07-05,"5 July 2024 by Paul CorrySian’s message to voters: 
 
“Thank you from the bottom of my heart to everyone in Brighton who has put their trust in me and the Green Party. This is a very special city, and together we’ve made history again.“I promise to work hard as your new Green MP and make sure your voices are heard in Parliament. By voting for me, you have demanded action on the NHS, the water companies, housing and the climate emergency, and I will be there to make sure the new Government delivers on all of these priorities.“I am infinitely grateful to Caroline Lucas for her support throughout the campaign, and for being such a model of how to be an effective MP for Brighton and the country.“It’s hard to express my delight at joining Carla Denyer, Adrian Ramsay and Ellie Chowns, I know they will all be brilliant.”Promoted by Chris Williams on behalf of The Green Party, both at PO Box 78066, London, SE16 9GQ",https://greenparty.org.uk/2024/07/05/sian-berry-has-won-brighton-pavilion-for-the-greens/,Green Party,UK,2024,467
