title,date,text,URL,Party,Country,Year,parlgov_party_id
Labour must “ramp up investment in better rail connections across the North of England” say Greens,2024-10-17,"17 October 2024 / 17 October 2024 by Green PartyResponding to the news that Labour is planning to build HS2 from London to Crewe (LBC), Green Party Transport Spokesperson, Matt Edwards, said,“A high-speed rail line connecting only the suburbs of London to Birmingham was the worst of all worlds. The Green Party welcomes the investment in our railways, but this is just one part of the puzzle, and the Labour government needs to ramp up investment in better rail connections across the North of England and connect the cities across the North of England to high-speed rail.”“Transport is still one of the biggest sources of emissions in the UK and high-speed rail is vital if we want to achieve Net Zero because it will free up overcrowded rail lines like the West Coast Mainline for more local services. But it needs to be done in the right way to protect the local environment.”Promoted by Chris Williams on behalf of The Green Party, both at PO Box 78066, London, SE16 9GQ",https://greenparty.org.uk/2024/10/17/labour-must-ramp-up-investment-in-better-rail-connections-across-the-north-of-england-say-greens/,Green Party,UK,2024,467
Greens say “no more incineration” of waste,2024-10-15,"15 October 2024 by Steve HyndResponding to the news that putting household rubbish in giant incinerators to make electricity is now the dirtiest way the UK generates power (BBC), Green Party Peer Baroness Jenny Jones said,“I highlighted the issue of incineration stopping councils from recycling back in 2010 when I was on the London Assembly. This became a national issue about 10 years ago when local authorities across the country started to treat waste as a fuel, rather than a valuable source that could be reused or recycled.“Unless we have a complete moratorium on new incinerators and start to close down existing ones, we will not meet either of the government’s big targets. You can’t burn oil in the form of plastic and meet the target of Net Zero emissions in 2050; nor can you sign up local authorities to 20 year contracts to burn waste and expect them to recycle 65% of waste by 2030. The last government was finally waking up to the direct contradiction between environment and incineration, I hope this government will say no more incineration and put this big mistake into reverse.”Promoted by Chris Williams on behalf of The Green Party, both at PO Box 78066, London, SE16 9GQ",https://greenparty.org.uk/2024/10/15/greens-say-no-more-incineration-of-waste/,Green Party,UK,2024,467
Greens warn that when government “cuts red tape” this too often means harming environmental standards and workers’ rights,2024-10-15,"15 October 2024 by Green PartyGreen Party MP for North Herefordshire, Ellie Chowns said: “Starmer’s pledge to investors that he will “cut red tape” is a tired cliché that, in practice, too often means harming environmental standards and workers’ rights. We’ve had fourteen years of successive Conservative governments promising to “cut red tape,” and all we have to show for it is a flatlining economy and falling living standards. If Starmer is serious about attracting investment to the UK, he will need a bolder approach that delivers on the “change” he promised in his election campaign. He could start by re-evaluating our relationship with our biggest trading partner, the European Union.”Promoted by Chris Williams on behalf of The Green Party, both at PO Box 78066, London, SE16 9GQ",https://greenparty.org.uk/2024/10/15/greens-warn-that-when-government-cuts-red-tape-this-too-often-means-harming-environmental-standards-and-workers-rights/,Green Party,UK,2024,467
Labour’s approach to Middle East conflict “failing” as civilian death toll mounts,2024-10-15,"15 October 2024 / 15 October 2024 by Green PartyGreen Party Co-Leader, Carla Denyer said, “The reports over the weekend that no food has entered Northern Gaza since the 1st of October, of Israel’s attack on al-Aqsa Hospital, of chemical weapons being used to attack UNIFIL peacekeepers, of mass civilian casualties in Gaza’s Jabalia Refugee Camp and of increased rocket fire into Israel from Hezbollah are extremely disturbing. The huge numbers of civilian deaths and the prospect of widespread starvation in Northern Gaza are intolerable.The Labour government must recognise that violence in the Middle East is escalating rapidly and that their current approach is failing. The Government needs to consider far more direct measures to incentivise a ceasefire including an end to arms sales, the introduction of divestments, boycotts and sanctions, prosecutions for all those who have committed war crimes and a plan for a viable Palestinian state.”Promoted by Chris Williams on behalf of The Green Party, both at PO Box 78066, London, SE16 9GQ",https://greenparty.org.uk/2024/10/15/labours-approach-to-middle-east-conflict-failing-as-civilian-death-toll-mounts/,Green Party,UK,2024,467
100 days of increasing solitude for Starmer,2024-10-12,"12 October 2024 / 11 October 2024 by Paul CorryCommenting on Labour’s first 100 days in office, Green Party Co-Leader Carla Denyer MP said:“The collapse in Starmer’s popularity since taking office has been remarkable. It was clear to me during the election campaign that voters across the country wanted change. After 14 years of Tory failure, they expected Labour to deliver it. The public’s sense of disappointment is palpable.“Instead, we have a government aligned with Tory austerity. The two-child benefit cap and the scrapping of the Winter Fuel Payment for millions of pensioners are both examples of how this government’s default has been to make the most vulnerable in our society pay. The ‘black hole in our finances’ should, and could, be solved by asking the wealthiest to pay just a fraction more. Instead, Labour seems content with letting the poorest bear the brunt.“It doesn’t have to be this way. We are one of the richest countries in the world, yet deeply unequal. The Chancellor has hinted that she is willing to borrow more to invest in much-needed infrastructure, which is welcome. But we also need to address the source of everyday revenue spending.“The last fourteen years have seen the rich get richer, with the top fifth now owning a third of the country’s wealth. It’s only fair that those with the broadest shoulders should now pay a bit more to help our NHS, rebalance society, and improve living standards for everyone. A wealth tax, alongside other changes to the tax system, could deliver this.“We as a country, and particularly the Labour government, face a political choice. Will they tax more fairly to properly invest in our crumbling frontline services, or will they continue to oversee managed decline and austerity economics? The Greens will, every day, keep pushing for them to properly invest in Britain.”Promoted by Chris Williams on behalf of The Green Party, both at PO Box 78066, London, SE16 9GQ",https://greenparty.org.uk/2024/10/12/100-days-of-increasing-solitude-for-starmer/,Green Party,UK,2024,467
"Greens welcome Renters’ Rights Bill but say it must go further on rent controls and ending ‘plague’ of cold, damp, mouldy homes",2024-10-09,"9 October 2024 / 9 October 2024 by Andrew BellCo-leader of the Green Party and MP for Bristol Central, Carla Denyer, will welcome the Renters’ Rights Bill in parliament later today, but will say it must go further in defending the rights of 11 million renters in the UK. Denyer said:“This is a once in a generation opportunity to recognise the rights of the 11 million people living in private rented housing to have a safe, decent and secure home. A chance to stop tenants being constantly uprooted and fleeced to pay for a roof over their heads.“In particular, we need a national system for rent controls with local flexibility aimed at bringing rents down relative to incomes.“We also need to tackle rented properties that are plagued with cold, damp or mould. We need to see a clear commitment to energy efficiency in the Bill to end the scandal of around 5 million renters living in such appalling conditions.“Such a Bill is long overdue. Greens hope it can be made even better and become truly transformative. Let’s make sure we use this opportunity to shift how we think about renting, moving away from viewing housing as assets, to prioritising and valuing the right to a stable home – in policy and practice.”NotesCarla Denyer MP and Sian Berry MP are expected to speak in the debate on the Bill in the Commons.Promoted by Chris Williams on behalf of The Green Party, both at PO Box 78066, London, SE16 9GQ",https://greenparty.org.uk/2024/10/09/greens-say-renters-rights-bill-must-go-further/,Green Party,UK,2024,467
“The claim that wealth taxes would lead to large numbers of people leaving the UK isn’t credible” say Greens,2024-10-09,"9 October 2024 / 9 October 2024 by Green PartyCarla Denyer, co-leader of the Green Party said: “The claim that wealth taxes would lead to large numbers of people leaving the UK isn’t credible. This didn’t happen when changes were made to non-dom status in 2017, and research by Patriotic Millionaires has shown that 68% of those with over £1 million to invest support a wealth tax themselves. There are lots of reasons that the wealthy choose to live in the UK, including work, family and culture, and many are happy to pay a bit more if it means a happier and healthier society.Between 2020 and 2022 alone, billionaire wealth in the UK increased by almost £150bn, whilst living standards for the rest of us fell significantly and public services decayed. It’s only through rebalancing our tax system to make it fairer that we can rebalance society, invest in our NHS and other public services, and ultimately increase the quality of life for ordinary Brits”.TaggedPromoted by Chris Williams on behalf of The Green Party, both at PO Box 78066, London, SE16 9GQ",https://greenparty.org.uk/2024/10/09/the-claim-that-wealth-taxes-would-lead-to-large-numbers-of-people-leaving-the-uk-isnt-credible-say-greens/,Green Party,UK,2024,467
Green Party reaction to fossil fuel lobbying for carbon capture and storage,2024-10-07,"7 October 2024 by Andrew BellCommenting on reports that the £22bn in subsidies awarded to carbon capture and storage projects followed a sharp increase in lobbying by the fossil fuel industry, co-leader of the Green Party, Adiran Ramsay MP said:“Revelations that this £22 billion bung to carbon capture and storage followed extensive lobbying reveals that it is the government that has been truly captured here – by the fossil fuel industry.“Labour ditched its pledge for £28bn investment in the transition to the green economy, yet they can stump up £22bn for an unproven technology which provides an excuse for fossil fuel companies to carry on polluting.“This money would be far better spent investing in reducing energy demand through a mass home insulation programme, in green energy and upgrading the grid – and on real carbon capture through restoring woodlands, peatlands and wetlands at scale.“Throwing billions into such a black hole rather than into the green transition makes no sense at all.”Promoted by Chris Williams on behalf of The Green Party, both at PO Box 78066, London, SE16 9GQ",https://greenparty.org.uk/2024/10/07/green-party-reaction-to-fossil-fuel-lobbying-for-carbon-capture-and-storage/,Green Party,UK,2024,467
Greens respond to carbon capture plans,2024-10-04,"4 October 2024 / 4 October 2024 by Paul CorryReacting to the government announcement of investment in carbon capture and storage projects, Green MP and party co-leader Adrian Ramsay said:“Labour has spent too long listening to the pleadings of energy companies for major public investment in unproven technological solutions like carbon capture that simply won’t deliver the immediate real change we need.“This announcement is no substitute for the urgent and immediate investment needed in home and business insulation to cut energy use and the increased renewables funding that is badly needed to meet future energy needs.”Promoted by Chris Williams on behalf of The Green Party, both at PO Box 78066, London, SE16 9GQ",https://greenparty.org.uk/2024/10/04/greens-respond-to-carbon-capture-plans/,Green Party,UK,2024,467
Green Party demand de-escalation of dangerous and mounting conflict in Middle East,2024-10-02,"2 October 2024 / 2 October 2024 by Andrew BellResponding to the increasingly dangerous situation in the Middle East, Sian Berry MP said:“We are deeply alarmed at last night’s attacks on Israel and the invasion of Lebanon, all of which show a growing escalation of the conflict. We express our solidarity with civilians under attack everywhere, whether in Israel, Lebanon, Gaza or elsewhere and demand that all sides de-escalate this dangerous and mounting conflict.“The failure of the US, UK and others to address Israel’s impunity when breaching international law has made this escalation inevitable. Only by creating the incentives needed for an immediate ceasefire in Gaza, prosecuting all actors who have perpetrated war crimes as charged by the ICC prosecutor and by seriously advancing the prospects of a Palestinian state can this dangerous situation be resolved.“The diplomacy of phone calls and statements is not enough. The UK needs to consider much more direct measures including ending arms sales to oblige all parties immediately to cease military action. All those responsible for attacks on civilians, which is a war crime, must face accountability.”Promoted by Chris Williams on behalf of The Green Party, both at PO Box 78066, London, SE16 9GQ",https://greenparty.org.uk/2024/10/02/green-party-demand-deescalation-in-middle-east/,Green Party,UK,2024,467
Green Party demands permanent bilateral ceasefire in Gaza and Lebanon,2024-10-01,"1 October 2024 / 1 October 2024 by Andrew BellCommenting on the escalating situation in the Middle East and on the invasion of Lebanon by Israeli defence forces, Sian Berry, MP for Brighton Pavilion, said:“The invasion and attacks on Lebanon by Israel, causing the deaths of over a thousand people and displacement of a million others, are horrific and devastating. The Green Party demands a permanent bilateral ceasefire in Gaza and Lebanon, a full arms embargo on Israel, and the prosecution of all actors who have perpetrated war crimes as charged by the ICC Prosecutor.“The international community has a moral and legal duty to hold all accountable – Israel, Hamas, Hezbollah and Iran – for their crimes in this escalating tragedy. There can be no excuse for the UK Government failing to uphold international law and to use any of the diplomatic levers it has available to bring about a ceasefire now.”Promoted by Chris Williams on behalf of The Green Party, both at PO Box 78066, London, SE16 9GQ",https://greenparty.org.uk/2024/10/01/green-party-demands-permanent-bilateral-ceasefire-in-gaza-and-lebanon/,Green Party,UK,2024,467
Closure of Ratcliffe-on-Soar power station a vital test for government’s green transformation say Green Party ,2024-09-30,"30 September 2024 by Andrew BellCommenting on the closure of the UK’s last coal-fired power station today, Green MP Carla Denyer said:“The end of coal-fired energy generation is an important step on the long road to tackling the climate crisis.“Thousands of people have been employed at Ratcliffe-on-Soar power station over the half-century it has been working. It has played an important role in the life of communities and the wider East Midlands economy.“This will be a vital test of how the government supports the green transformation of every sector of our economy – fast and fairly – to meet the needs of the environment and future generations.“Plans to clear the site and replace the power station with a zero-carbon energy and technology park must become a reality, offering well-paid, secure jobs.”Promoted by Chris Williams on behalf of The Green Party, both at PO Box 78066, London, SE16 9GQ",https://greenparty.org.uk/2024/09/30/closure-of-ratcliffe-on-soar-power-station-a-vital-test-for-governments-green-transformation-say-green-party/,Green Party,UK,2024,467
Green Party reaction to vote on winter fuel payments at Labour conference,2024-09-25,"25 September 2024 / 25 September 2024 by Andrew BellReacting to a motion on winter fuel payments put forward by the Unite union and supported by a majority of delegates at Labour Party conference, co-leader of the Green Party, Carla Denyer, said:“Today’s vote at Labour Party conference leaves Labour ministers out in the cold. There is a groundswell of support – from opposition parties, unions, many Labour MPs, health workers, disability groups, charities supporting pensioners, as well as others – for ensuring millions of pensioners keep warm this winter.“Targeting some of the most vulnerable to fix the supposed black hole in the public finances is cruel and unnecessary.“There is another way. A fairer way. As the successful motion by Unite makes clear, taxing multi-millionaires and billionaires a little more would not only easily cover the cost of winter fuel payments for all pensioners but also generate additional funds for much needed investment in our health and social care services.”Promoted by Chris Williams on behalf of The Green Party, both at PO Box 78066, London, SE16 9GQ",https://greenparty.org.uk/2024/09/25/green-party-reaction-to-vote-on-winter-fuel-payments-at-labour-conference/,Green Party,UK,2024,467
Green Party reaction to Labour response to Darzi review of NHS,2024-09-12,"12 September 2024 by Andrew BellResponding to Keir Starmer’s speech on Lord Darzi’s review of the state of the NHS, co-leader of the Green Party, Adrian Ramsay MP, said:“The Darzi review pulls no punches: the NHS has been harmed by austerity, capital starvation, the disastrous 2012 Health and Social Care Act and the dire state of social care.“It is therefore hugely disappointing to see Labour, like a string of previous Conservative and Labour governments, hooked on reform rather than investment.“Starmer says there can be no money without reform. We say there can be no improvement to waiting times, cancer death rates, treatment for mental health – and many other struggling areas – without more money.“We agree that we cannot ask working people to foot the bill through higher taxes. But it is fair to ask the super-rich to pay a little more through wealth taxes. This could generate billions towards the investment the NHS is crying out for.“‘Reform’ has in the past been used as a stalking-horse for privatisation. The Green Party completely rejects privatisation and fragmentation of the NHS. Private companies are focused on creaming off profits which can result in degraded services and more people not getting the treatment they need from the NHS.“We must avoid a two-tier health service where those who can afford to go private to get treated do, while those who can’t don’t. The NHS was designed to serve all free at the point of use and this must remain its core mission.”“We welcome a focus on helping our nation back to health. This can help heal our NHS. But again, improving public health will require investment in those things which lead to improved physical and mental health such as quality housing, good jobs, infrastructure for active travel and healthy food. Greens have always supported working to improve health rather than just treating sickness.”Promoted by Chris Williams on behalf of The Green Party, both at PO Box 78066, London, SE16 9GQ",https://greenparty.org.uk/2024/09/12/green-party-reaction-to-labour-response-to-darzi-review-of-nhs/,Green Party,UK,2024,467
"Greens blast Labour on steel, calling for public ownership to secure green steel, jobs, and communities ",2024-09-11,"11 September 2024 by Andrew BellReacting to the announcement by the UK government that it will grant Tata Steel £500m towards the cost of building a greener electric furnace in Port Talbot, but that around 2,800 workers are set to be made redundant, Wales Green Party leader Anthony Slaughter said:“This is the first test of the new Labour government’s commitment to a just green transition that protects jobs and the environment – and it has been found wanting.“I’ve spoken with countless families around Port Talbot who have shared with me their distress and fears for the future, not just those directly employed but in the wider supply chain.“Labour promised a new approach during the General Election. It raised hopes across the steel industry – here in South Wales and in the North East of England – that the necessary and urgent move to cleaner production methods could be achieved without devastating communities.“We know only too well how mining communities suffered when successive Tory governments shut pits without plans in place for new jobs. Labour should have learnt those lessons.“The private companies are to get huge taxpayer subsidies without any guarantees that they will protect and create skilled, well-paid, secure jobs for the future.“The Green Party knows that can be achieved. Our steel communities need the long-term commitment and political will that this Labour government lacks.“By 2030, the European Union is expected to be home to nearly 50 green and low-carbon steel projects, facilitated by governments working together to deliver a planned strategy to move away from fossil fuels.“Yet, this new government shuns joining with partners across the EU in a green industrial revolution.“Transitioning to a green economy could create up to a million jobs. To achieve that, we need a government in Westminster and the Senedd that is willing to use its full powers – including bringing vital industries like steel into public ownership.“Today was Labour’s chance to show that it is prepared to lead. Sadly, it has fallen short.”Promoted by Chris Williams on behalf of The Green Party, both at PO Box 78066, London, SE16 9GQ",https://greenparty.org.uk/2024/09/11/greens-blast-labour-on-steel-calling-for-public-ownership-to-secure-green-steel-jobs-and-communities/,Green Party,UK,2024,467
