title,date,text,URL,Party,Country,Year,parlgov_party_id
Greens launch General Election campaign for real hope and real change,2024-05-30,"30 May 2024 / 9 June 2024 by Green PartyCo-leader, and parliamentary candidate for Bristol Central, Carla Denyer will tell the party’s General Election campaign launch later today:“Across the country, people now have the chance to vote for real hope and real change.“Our politics is broken, our public services are on their knees and people are worse off now than when the Conservatives came to power 14 years ago.The case for change is obvious, but it has to be real change that offers real hope. Half measures and broken pledges will not do.“The Conservatives are clearly on their way out of government, but Labour is failing to offer the real change needed.“We have the practical solutions to the cost-of-living crisis, building new affordable homes, protecting our NHS from creeping privatisation and cleaning up our toxic rivers and seas.”The party’s campaign launch will take place in Bristol, where the party now leads the council after winning every single seat in the Bristol Central constituency.Co-leader Adrian Ramsay, who is standing in the new Waveney Valley constituency on the Norfolk/Suffolk border, will say:“After so much damage by the outgoing Conservative government, we need more than a few tweaks from a new Labour government. Green MPs will push the next government for bold action to achieve the real changes that are needed to confront the big challenges our country faces.“Over the past five years, we have increased the number of councillors five-fold. Greens have dramatically increased our number of councillors elected, from here in Bristol, to councils across Waveney Valley and from Newcastle to Hastings.“Over the next few weeks, we will build on that success and on 4 July ask voters to elect at least four Green MPs in our target seats and support our candidates standing across England and Wales. We are offering real hope and real change.”NOTES TO EDITORSThe Green Party of England and Wales aims to stand candidates in every constituency, with its best chances in:Promoted by Chris Williams on behalf of The Green Party, both at PO Box 78066, London, SE16 9GQ",https://greenparty.org.uk/2024/05/30/greens-launch-general-election-campaign-for-real-hope-and-real-change/,Green Party,UK,2024,467
Labour offering fantasy plans for NHS,2024-05-29,"29 May 2024 / 9 June 2024 by Green PartyReacting to Labour’s NHS plans, Green Party co-leader and parliamentary candidate for Waveney Valley, Adrian Ramsay said:“Labour is offering fantasy plans to end the NHS crisis. It wants to pay the private sector more, make existing staff work longer hours and squeeze more patients into overcrowded wards.“Waiting for growth, won’t cut waiting lists.“You can’t seriously reduce the waiting lists, or build a health service for the future, without raising the money you actually need through fairer tax, as well as tackling the profit motive.“Greens will, next week, be unveiling our practical solutions that offer real hope and real change, support staff and invest in facilities to defend our NHS.”Promoted by Chris Williams on behalf of The Green Party, both at PO Box 78066, London, SE16 9GQ",https://greenparty.org.uk/2024/05/29/labour-offering-fantasy-plans-for-nhs/,Green Party,UK,2024,467
Greens respond to Labour’s economic plans,2024-05-28,"28 May 2024 / 9 June 2024 by Green PartyReacting to Labour’s plans to chase narrow economic growth over other priorities, Adrian Ramsay said:“The transition to a green economy provides major opportunities which we must grasp – opportunities for warmer homes, lower bills and good new jobs. The Green Party would invest in the technologies we need to ensure a sustainable and secure future.“But we would not be chasing growth for growth’s sake. We need to ensure our economy works in a way that safeguards our climate and enables nature to flourish.“And we need to make sure the economy we are building is fairer as well as greener.“This is why we would secure the investment needed to restore our public services by asking the very richest in society to contribute more. Even modest changes to the tax system for the wealthy could make a big differences – and only the Green Party is pledging to do this.”Promoted by Chris Williams on behalf of The Green Party, both at PO Box 78066, London, SE16 9GQ",https://greenparty.org.uk/2024/05/28/greens-respond-to-labours-economic-plans/,Green Party,UK,2024,467
Greens respond to Conservative plans for national conscription for 18 year olds,2024-05-26,"26 May 2024 / 9 June 2024 by Green PartyResponding to the news that The Conservatives plan to bring back national conscription, Green Party Co-Leader, Carla Denyer said,“This policy is removed from reality. It is not what our military needs and it certainly isn’t what our young people need.“What young people tell us they need is access to the housing market, to higher education that doesn’t plunge them into debt, and to meaningful jobs that pay well.“Not military conscription.“It is striking just how removed this Conservative government is from the priorities of young people today”.Promoted by Chris Williams on behalf of The Green Party, both at PO Box 78066, London, SE16 9GQ",https://greenparty.org.uk/2024/05/26/greens-respond-to-conservative-plans-for-national-conscription-for-18-year-olds/,Green Party,UK,2024,467
Green Party reacts to new energy price cap,2024-05-24,"24 May 2024 / 9 June 2024 by Green PartyGreen Party co-leader Carla Denyer welcomed the latest energy price cap drop, but warned it still left average consumers with bills £400 higher than before the energy crisis.Denyer said:“Consumers are still paying for a crisis not of their making.“Neither the Conservatives nor Labour are offering the real, practical, lasting solutions that can bring down people’s bills and protect the environment by reducing home energy use.“Fiddling with the price cap is not enough.“A mass programme of government-backed, council delivered home insulation starting immediately after the General Election is a win-win solution for people and the planet and offers people hope and positive change.“We could reduce bills for the long term and help reduce greenhouse gas emissions by building new homes that are easier and cheaper to heat and boosting insulation in existing homes. Insulating people’s homes means they can stay warm while using less energy, save money and produce fewer harmful carbon emissions.”Promoted by Chris Williams on behalf of The Green Party, both at PO Box 78066, London, SE16 9GQ",https://greenparty.org.uk/2024/05/24/green-party-reacts-to-new-energy-price-cap/,Green Party,UK,2024,467
Greens urge election focus on hope and positive change  ,2024-05-22,"22 May 2024 / 9 June 2024 by Green PartyThe Green Party welcomes the General Election as the chance for voters to choose hope and practical solutions to the crises facing the country.Co-leader and parliamentary candidate for Bristol Central Carla Denyer said:“At last. This is the moment the country has been waiting for – the chance to vote for a different vision of what our country can be. We are urging voters to elect at least four Green MPs to Parliament.”Co-leader and parliamentary candidate for Waveney Valley Adrian Ramsay said:“We are ready. Across the country people will have the chance to vote for a Green candidate offering voters hope and practical solutions to the cost-of-living crisis, supporting people into warm, affordable homes, protecting our NHS and cleaning up our toxic rivers.Denyer added:“By reforming our tax system to make it fairer – including a tax on the super-rich billionaires and multi-millionaires – we would raise £50billion to invest in our NHS, warmer homes and cleaner rivers.”Ramsay added:“We are offering the common sense, affordable policies that will dramatically improve our quality of life. More Green MPs in Parliament will hold whoever forms the next government to account, and make the other parties confront the challenges our country faces. Together, we can make the change.”NOTES TO EDITORSThe Green Party of England and Wales will stand candidates in every constituency, with its best chances in:For more information and to arrange interviews contact: press@greenparty.org.uk. Tel: 0203 691 9401.Promoted by Chris Williams on behalf of The Green Party, both at PO Box 78066, London, SE16 9GQ",https://greenparty.org.uk/2024/05/22/greens-urge-election-focus-on-hope-and-positive-change/,Green Party,UK,2024,467
Green Party backs ICC in seeking arrest warrants for Hamas and Israeli war criminals,2024-05-20,"20 May 2024 / 9 June 2024 by Green PartyResponding to the announcement by the International Criminal Court (ICC) that it is seeking arrest warrants for senior Hamas and Israeli officials for war crimes and crimes against humanity, including the Israeli prime minister, Benjamin Netanyahu, Green Party spokesperson for global solidarity, Carne Ross, said:“The ICC prosecutor’s announcement today sets out in horrifying detail the brutal decisions undertaken by the leaders of both Hamas and Israel.“Green Party leaders wrote to the foreign secretary David Cameron six months ago setting out how war crimes had been committed by both sides [1]. The UK government must now stop denying the heinous crimes perpetrated by the government of Israel and its defence forces including, according to the ICC, the starvation of civilians, wilfully causing great suffering and intentionally directing attacks against a civilian population.“This is a big test for David Cameron who has to date refuted any suggestion of war crimes by Israel and refused to reveal the government’s legal advice. Under the Rome Statute, which the UK helped write, he is obliged to support this ICC process. The government’s claim that it supports the international rule of law is being put to the test.”Notes[1] https://www.greenparty.org.uk/news/2023/11/01/green-party-urges-uk-government-and-opposition-to-call-for-ceasefire-in-israel-gaza-conflict/Promoted by Chris Williams on behalf of The Green Party, both at PO Box 78066, London, SE16 9GQ",https://greenparty.org.uk/2024/05/20/green-party-backs-icc-in-seeking-arrest-warrants-for-hamas-and-israeli-war-criminals/,Green Party,UK,2024,467
Joint Statement with Lord Mann,2024-05-15,"15 May 2024 / 9 June 2024 by Green PartyJoint Statement from the Co-Leaders and Deputy Leader of The Green Party and Lord Mann, the Government’s Independent Advisor on Antisemitism:“Lord Mann and the leadership team at The Green Party of England and Wales met last week to discuss the important issue of antisemitism. Both parties have committed to continued dialogue and working together to ensure that antisemitism, like all racism, has no place in Green politics and to better educate Green representatives about anti-Jewish racism. The Green Party has taken a series of proactive steps towards these goals but understands that this will take consistent work going forward.”Promoted by Chris Williams on behalf of The Green Party, both at PO Box 78066, London, SE16 9GQ",https://greenparty.org.uk/2024/05/15/joint-statement-with-lord-mann/,Green Party,UK,2024,467
Green Party reaction to Sunak’s Policy Exchange speech,2024-05-13,"13 May 2024 / 10 June 2024 by Green PartyResponding to the prime minister’s ‘security’ speech at Policy Exchange [1], in which Rishi Sunak said “we must be prepared strategically, economically, with robust plans and greater national resilience, to meet this time of instability with strength, co-leader of the Green Party Adrian Ramsay said:“The prime minister’s speech on security failed to make a single mention of the threats posed by climate change in spite of the government’s own Climate Change Committee being clear that this is one of the biggest challenges of our generation. With land and sea temperature records being broken on an almost daily basis, this is an emergency.“Yet instead of announcing any new climate commitments, Sunak chose instead to vilify those pushing for climate action, accusing them of ideological zeal. He also trotted out the tired excuse for inaction, that the costs of achieving Net Zero were too great and would disrupt people’s lives. The reality is that the Conservatives’ decision to listen to the siren song of the fossil fuel industry means we are being left behind in the economic transition.“The Green Party understands that the cost of inaction on climate far outweighs the cost of action. We also know the huge disruption to people’s lives that climate breakdown will cause. That’s why Greens want to see investment in insulating homes and turbocharging renewable energy. These sorts of investments will bring down people’s energy bills, create thousands of new jobs and give us real energy security.”NotesPromoted by Chris Williams on behalf of The Green Party, both at PO Box 78066, London, SE16 9GQ",https://greenparty.org.uk/2024/05/13/green-party-reaction-to-sunaks-policy-exchange-speech/,Green Party,UK,2024,467
Greens call for safe and legal routes,2024-05-10,"10 May 2024 / 9 June 2024 by Green PartyResponding to Labour Leader Keir Starmer’s speech in Dover, Green Party co-leader Adrian Ramsay said:“Labour is right to signal it will abandon the government’s inhumane Rwanda deportation plan, but it has failed to offer people seeking asylum the safe and legal routes that would offer a real alternative to people smugglers, or tackle the roots of the asylum crisis.“I don’t want people risking their lives crossing the channel in small boats.“But the way to end this awful spectacle isn’t Labour’s punitive, inhumane alternative to the Conservatives ’failed Rwanda scheme.“It is providing safe and legal routes for people to apply for asylum from overseas, working for strong international co-operation on supporting asylum seekers and working to address the reasons that people are having to claim asylum – including wars, poverty and the climate crisis.”Promoted by Chris Williams on behalf of The Green Party, both at PO Box 78066, London, SE16 9GQ",https://greenparty.org.uk/2024/05/10/greens-call-for-safe-and-legal-routes/,Green Party,UK,2024,467
Greens call for nature protection in wake of river report,2024-05-09,"9 May 2024 / 9 June 2024 by Green PartyReacting to a new report from the Office for Environmental Protection which says: “government will not meet its ambition that most water bodies will be on the road to good condition or else already in that state by 2027,” Green Party co-leader Carla Denyer said:“The Green Party wants to see much greater protection of nature in law, and that includes our rivers.“We would set up an Independent Commission for Nature that would set targets for nature protection and restoration, enforced through the courts.“This would be groundbreaking and make future governments act to protect our waterways from agricultural and industrial pollution.“It would allow for the first time the possibility of individuals, communities and conservation groups taking legal action on behalf of nature. Currently, every time our rivers, seas or land is polluted, prosecution is left to hopelessly underfunded quangos.“We also need water companies in public ownership and an end to leaking sewage.“We need to give space for all of nature to thrive, and that includes protecting our rivers.”Promoted by Chris Williams on behalf of The Green Party, both at PO Box 78066, London, SE16 9GQ",https://greenparty.org.uk/2024/05/09/greens-call-for-nature-protection-in-wake-of-river-report/,Green Party,UK,2024,467
Greens call for action on rooftop solar as new temperature records broken,2024-05-08,"8 May 2024 / 10 June 2024 by Green PartyThe Green Party has called for mandatory solar PV panels to be fitted on all appropriate new buildings and for all new homes to be built to Net Zero Carbon Buildings Standards.The call comes as analysis (1) finds that the world’s oceans have broken temperature records every single day over the past year and that the EU’s Copernicus Climate Change Service (2) reports April was the hottest month on record globally. Greens accuse both the government and Labour of refusing to take the actions necessary to rapidly bring down the UK’s greenhouse gas emissions and avert climate breakdown.Co-leader Carla Denyer said:“The evidence of climate breakdown is mounting. Yet the Tory government pours fuel on the fire by dishing out licenses for new oil and gas exploration. Just last week (3) the High Court ruled that the government is failing to do enough to meet its targets for cutting greenhouse gas emissions and will be required to redraft the plan again.“The Green Party would love to help with this redraft. We can offer two simple, sensible and practical measures – just as starters. Fitting solar panels to all appropriate new buildings should be mandatory and building regulations should be changed so that every new home is built to Net Zero standards. These two measures are examples of how tackling our greenhouse gas emissions can also bring down fuel bills.“The world has achieved a new landmark with a record-breaking 30% of the world’s electricity last year being generated from renewables. But the UK is lagging behind in this renewable energy revolution – and all the jobs and improved wellbeing for people that comes with this. By cutting their £28bn pledge for green investment, Labour is also failing to grasp the seriousness of the climate crisis or the potential benefits of taking climate action. Labour just don’t get the fact that the cost of inaction on climate change far outweighs the cost of action.“Thankfully, after our hugely successful local election results which has resulted in a total of 809 councillors on 174 Councils, we can look forward to Greens having more influence in scaling up renewable energy and ensuring everyone has a secure, warm and affordable home.”Promoted by Chris Williams on behalf of The Green Party, both at PO Box 78066, London, SE16 9GQ",https://greenparty.org.uk/2024/05/08/greens-call-for-action-on-rooftop-solar-as-new-temperature-records-broken/,Green Party,UK,2024,467
Greens on track to win parliamentary seats following record local election results ,2024-05-04,"4 May 2024 / 9 June 2024 by Green PartyThe Green Party is celebrating an historic electoral victory after it emerged as the largest party on Bristol City Council and won every available seat in their target parliamentary constituency of Bristol Central.Across the city, the Green Party won 34 seats, becoming by far the largest party in the city and the largest group of Green councillors ever elected to a council in the UK.Co-leader, Carla Denyer, who is standing as parliamentary candidate in Bristol Central, said:“Bristol Central has turned totally Green. We’ve won all 14 council seats in the new parliamentary constituency, paving the way for the city to get its first ever Green MP at the forthcoming general election. As MP candidate for Bristol Central, I look forward to giving Bristolians another opportunity to make history. After these resounding local election results, the people of Bristol know that we don’t have to accept politics as usual – something better is possible if we vote for it.”Greens also became the largest group on Stroud and Hastings Councils with 22 and 12 councillors respectively. And the Party won a by-election in Bunwell ward in South Norfolk, forcing the Conservatives to lose their majority on South Norfolk Council. The ward is in the new Waveney Valley constituency where co-leader Adrian Ramsay hopes to become the next MP. He said:“Over the last five local elections in England we have seen an almost five-fold increase in the number of Green councillors. The victories and the places where we have won means we are on course to see a similar increase in the number of MPs at the next general election.“But this isn’t just about what it means for the General Election, it’s also what it means for those people who live in areas where Greens have power.“We’re now the largest party on key English councils including Hastings, Stroud, East Hertfordshire, Babergh, East Suffolk, Mid Suffolk, Lewes, Folkestone and Hythe, the Forest of Dean, as well as Bristol of course.”    
   
“Voters are increasingly turning to the Greens because we offer a real alternative, with sensible and practical policies to tackle local and national issues such as the cost of living, the housing crisis, underfunded and run-down public services and the terrible state of our rivers.”Promoted by Chris Williams on behalf of The Green Party, both at PO Box 78066, London, SE16 9GQ",https://greenparty.org.uk/2024/05/04/greens-on-track-to-win-parliamentary-seats-following-record-local-election-results/,Green Party,UK,2024,467
Greens win every council seat in target Bristol Central constituency and cement role as largest party on Council amid “record breaking” election campaign,2024-05-03,"3 May 2024 / 9 June 2024 by Green PartyIn a historic electoral victory, amid a record-breaking local election campaign, the Green Party has this evening not only emerged as the largest party on Bristol City Council, but has also won every available seat in their target parliamentary constituency of Bristol Central.Across the city, the Green Party has won 34 seats in the city’s local elections, strengthening their position as the largest party in the city and supporting the polls’ suggestion that Bristol could elect its first ever Green MP. Today’s gains also see them become the largest group of Green councillors to ever be elected at a local election in the UK.Carla Denyer, the Green Party Co-Leader and parliamentary candidate for Bristol Central, commented on the success in the city: 
 
“At this election the people of Bristol have turned to the Green Party to deliver the change that this city needs.“The people of this city know that we don’t have to accept politics as usual – something better is possible if we vote for it.”The Green Party dominance at the city’s local elections is another sign that the Greens are on track to win their top General Election target of Bristol Central where party co-leader, Carla Denyer, is the candidate. Greens won all 14 council seats in the new Bristol Central constituency.Denyer continued:“As MP candidate for Bristol Central at the coming General Election, I’m looking forward to giving Bristolians another opportunity to demonstrate their values by voting for real change and hope at the national level.”The victories come alongside what pollster Sir John Curtice described as “spectacular gains” in seats across the UK from Newcastle to Exeter. The Party is now setting its sights on securing 4 Members of Parliament including in the new seat of Bristol Central where Greens now hold 14 of the 14 councillors.Co-leader Adrian Ramsay welcomed the record results across England, including earlier becoming the largest party on Hastings Borough Council. He said:“We went into these elections with a record number of Green councillors.“We’re emerging with a new, even higher record.  
 
“I know Carla will be a great MP for Bristol if elected at the next election.“But this isn’t just about what it means for the General Election, it’s also what it means for those people who live in areas where Greens have power.“We’re now the largest party on key English councils including not just Bristol but also Hastings, East Hertfordshire, Babergh, East Suffolk, Mid Suffolk, Lewes, Folkestone and Hythe and the Forest of Dean.”   
 
He continued:“These record results represent a seismic shift in English politics.“Voters are increasingly turning to the Greens because we offer a real alternative, with sensible and practical policies to tackle local and national issues such as the cost of living, the housing crisis, underfunded and run-down public services and the terrible state of our rivers.”“The excellent result in Bristol builds on our huge breakthrough last year in gaining control of Mid Suffolk District Council – in the area where I’m standing to be MP for the new Waveney Valley seat.“This and Bristol Central will join Brighton and North Herefordshire among our top target seats at the general election.”Promoted by Chris Williams on behalf of The Green Party, both at PO Box 78066, London, SE16 9GQ",https://greenparty.org.uk/2024/05/03/greens-win-every-council-seat-in-target-bristol-central-constituency-and-cement-role-as-largest-party-on-council-amid-record-breaking-election-campaign/,Green Party,UK,2024,467
