title,date,text,URL,Party,Country,Year,parlgov_party_id
"“Now is the time to make clear we, as a country, stand with Zelensky in working for a lasting just peace.”",2025-02-28,"28 February 2025 by Green PartyResponding to the “bullying” and “shameful” behaviour of President Trump towards President Zelensky, Green Party MP, Ellie Chowns, said:“What we witnessed today was bullying from one of the most powerful men in the world. It was the antithesis of the diplomacy needed in such a delicate moment. While many Brits watched on in horror with real fear, we call on the Prime Minister to make abundantly clear that he stands with Zelensky in working for a just peace and opposed to the strongman brinkmanship tactics of President Trump. Today’s shameful behaviour by the American administration- of inviting a leader to their country with the intention to bully and humiliate – must be clearly condemned. Now is the time to make clear we, as a country, stand with Zelensky in working for a lasting just peace.”TaggedPromoted by Chris Williams on behalf of The Green Party, both at PO Box 78066, London, SE16 9GQ",https://greenparty.org.uk/2025/02/28/now-is-the-time-to-make-clear-we-as-a-country-stand-with-zelensky-in-working-for-a-lasting-just-peace/,Green Party,UK,2025,467
"Gatwick expansion unwanted, say Greens",2025-02-27,"27 February 2025 by Green PartyResponding to the Transport Secretary’s decision to pursue a positive decision for Gatwick Airport to bring its northern terminal into constant use, (1) Siân Berry Green MP for Brighton Pavilion said:“The Labour government is trashing its climate credentials one absurd decision at a time. Only one day after receiving critical advice from its own climate advisors on the need to lower flying demand, ministers continue to support yet more unnecessary expansion for the benefit of wealthy investors.“Pushing through these damaging plans shows such poor economic judgement. Over 100,000 extra flights a year won’t deliver for our communities. Labour should listen to the public who think airport expansion is the wrong priority. Most of us fly once a year if at all and would rather see cheaper train tickets and more bus routes instead to help with our daily journeys and create jobs where we live, in contrast with frequent flyers leaching money out of the economy.“The green economy grew by ten per cent last year, and this is where Labour should be investing to deliver high-wage, long-term jobs across the entire country.”(1) Transport planning: Gatwick Airport – GOV.UKPromoted by Chris Williams on behalf of The Green Party, both at PO Box 78066, London, SE16 9GQ",https://greenparty.org.uk/2025/02/27/gatwick-expansion-unwanted-say-greens/,Green Party,UK,2025,467
"“There should be zero tolerance of coercion, violence, or sexual abuse.”",2025-02-27,"27 February 2025 / 27 February 2025 by Green PartyIn response to the review out today concluding that degrading, violent and misogynistic pornography should be banned, Green Party Baroness, Jenny Jones said:

“Online pornography is a space where those who wish to abuse women are currently operating with virtual impunity. We’re clear that it’s the role of government to prevent this abuse, just as we would offline. Strengthening controls for online content is a good first step as we reiterate that there should be zero tolerance of coercion, violence, or sexual abuse.”TaggedPromoted by Chris Williams on behalf of The Green Party, both at PO Box 78066, London, SE16 9GQ",https://greenparty.org.uk/2025/02/27/there-should-be-zero-tolerance-of-coercion-violence-or-sexual-abuse/,Green Party,UK,2025,467
Greens press government to act on Grenfell oversight,2025-02-26,"26 February 2025 / 26 February 2025 by Green PartyResponding to the government’s announcement that it will accept all the recommendations from the Grenfell Tower Inquiry (1), Green MP Carla Denyer urged the government to accept her Private Members’ Bill on preventing future deaths.Carla’s Bill calls for the creation of a National Oversight Mechanism which would have responsibility for ensuring that recommendations made following inquests and inquiries are followed. Currently, there is no body which has this responsibility.Reacting to the government’s statement, Carla Denyer MP said:“The deaths of 72 people in the Grenfell tower fire was an unimaginable tragedy, but worse, it was an avoidable tragedy. We owe it to those who lost their lives to make sure nothing like this happens again.“I welcome the Government’s commitment to taking forward all of the report’s recommendations, a vital first step towards justice.“The Grenfell Inquiry recognised a failure of the state to properly follow up on the recommendations made by inquests and inquiries – meaning that too often, changes needed to prevent people from harm are simply not made. Time and time again, bereaved families go through the trauma of reliving the circumstances of a loved one’s death at an inquest only for the lessons from that death to be forgotten.“We urgently need an organisation responsible for making sure that recommendations from inquests and inquiries are actually followed, rather than being forgotten. I have put forward a Bill to create a National Oversight Mechanism for state-related deaths, which would do just that. It would be an independent body, able to scrutinise government action so bereaved families don’t have to be the ones fighting for change.“The National Oversight Mechanism proposal has the support of over 70 organisations, including Grenfell United, Amnesty, the Mayor of London, and the Institute for Government. It recently featured as a recommendation in the Health Services Safety Investigations Body’s report on deaths of mental health patients. It’s clear that this is badly needed, and I hope the government will support my Bill.”(1) Government responds in full to Grenfell Tower Inquiry, setting out tough new reforms to fix building safety and strengthen accountability  – GOV.UKPromoted by Chris Williams on behalf of The Green Party, both at PO Box 78066, London, SE16 9GQ",https://greenparty.org.uk/2025/02/26/greens-press-government-to-act-on-grenfell-oversight/,Green Party,UK,2025,467
Green Party demands ambitious action in wake of Climate Change Committee report,2025-02-26,"26 February 2025 / 26 February 2025 by Green PartyAs the Climate Change Committee publishes its 7th carbon budget [1], the co-leader of the Green Party, Adrian Ramsay MP, has demanded the Government ensure ambitious climate action isn’t delayed any further – and for polluters to pay the highest price, not the poorest in our communities.Adrian Ramsay MP said: “Today’s advice from the Climate Change Committee (CCC) makes clear that a climate safe future is still within our grasp – and that the cost of not reducing climate emissions will be far higher for our economy than the cost of investment in net zero. Crucially, we need to see the Government make investment choices that result in households benefiting financially from climate action too – both by ensuring everyone can access renewables and energy efficiency and because they are paying lower bills. The public are clear that they want to see the worst climate polluters pay, and we need to make sure that the costs of climate action never fall on those least able to afford it.“A thriving green economy is also vital if we are to prevent climate deniers, like Reform, from weaponising the mass destruction of climate chaos. Instead, we must help the most vulnerable and build resilience in communities to adapt to climate breakdown.”He continued: “Without an immediate acceleration of climate ambition, our economy, national security and environment are all at serious risk. That’s why we are disappointed not to see the CCC go even further on measures to reduce energy demand. In the face of impending airport expansion decisions by this Labour government, more ambitious policy is urgently needed to keep the aviation sector in check. Their advice shows strong public support for limiting airport expansion and introducing a frequent flier levy where the small percentage of the population who take the vast majority of the flights have to pay more .“The CCC have shown that a positive, fairer, jobs-rich, greener future is possible, and they have set a clear pathway for the Government to follow. Now, we need the Government to step up, stop the vested interests who are intent on delaying, and show the ambition and leadership this moment demands.”NotesTaggedPromoted by Chris Williams on behalf of The Green Party, both at PO Box 78066, London, SE16 9GQ",https://greenparty.org.uk/2025/02/26/green-party-demands-ambitious-action-in-wake-of-climate-change-committee-report/,Green Party,UK,2025,467
Green parliamentarians write to Defence Secretary over defence spending principles,2025-02-25,"25 February 2025 / 26 February 2025 by Green PartyThe six Green Party parliamentarians have written to the Defence Secretary John Healey setting out a series of “core principles” they say any decisions about defence spending should be based on [1].The letter comes as Keir Starmer announced that a rise in the defence budget will be funded by cuts to foreign aid.In the letter, the MPs and peers call on Healey to ensure that all decisions on defence spending “tackle the biggest threats to long term human security, including climate chaos, food insecurity, and cyber-attacks on democracy”.They also urge an increase in spending on diplomacy, peace-building and overseas aid in order to improve our security.Responding to Starmer’s announcement today, Ellie Chowns MP said:“It’s horrifying to see Keir Starmer follow Trump’s lead, gutting our international aid budget to increase defence spending. This is naive populism playing with life-and-death decisions.“How many people will fall ill or die because they cannot access health services; how many more will go hungry? And how many children will be denied an education as a result of this decision? Cutting aid risks making the world more volatile and more dangerous, not safer. Real security means tackling hunger, poverty, and climate chaos.“Taking money from the poorest in the name of defence is both cruel and unnecessary – we could and should instead be taxing the wealthiest who can afford to contribute more.“The idea that the only way to strengthen our defences is by taking from those with the least is immoral. It’s a choice and it’s the wrong one.”Notes:Dear John,We are writing to set out the importance of any decisions about future defence spending being underpinned by core principles. In an ever more insecure world, made more unstable by the comments and actions of the US President, and with the ongoing need to stand up to Putin, it is vital that genuine long-term stability, safety and security is a priority. Alongside addressing the threats posed by the international political situation, the government must also address the significant and growing security threats relating to climate breakdown, food security and cyber security.As such, we call on you to uphold the following principles:We look forward to your response and to working constructively with the government towards enduring safety and security.Yours sincerely, all Green parliamentariansTaggedPromoted by Chris Williams on behalf of The Green Party, both at PO Box 78066, London, SE16 9GQ",https://greenparty.org.uk/2025/02/25/green-parliamentarians-write-to-defence-secretary-over-defence-spending-principles/,Green Party,UK,2025,467
Standing in solidarity with Ukraine,2025-02-22,"22 February 2025 / 25 February 2025 by Green PartyOn the weekend of the third anniversary of Russia’s war on Ukraine, Green Party co-leaders Carla Denyer and Adrian Ramsay said:“Across the world, people will be standing in solidarity with Ukraine, facing the third anniversary of Russia’s invasion.“Yes, Russia started the war and Yes, Ukraine is a democracy with an elected President. That we have to restate these simple facts is shocking but necessary because US President Donald Trump has chosen to buy into and amplify the lies and disinformation of the Russian state.“Russian President Vladimir Putin is a dangerous tyrant. It is deeply worrying that President Trump is now joining him in spreading lies, attacking democracy, sowing division and chaos, and undermining the rule of law.“We want this war to end, and we want peace talks.“Our unwavering position is that the voice of Ukraine must be front and centre of the peace talks that must take place. It is for the people of Ukraine to decide their future. Not Putin, not Trump.“The UK government could and should be doing much more to tighten sanctions on Russia.  Sales of Russian fossil fuels are paying for the missiles and drones used to attack Ukrainian civilians.“The UK government must close all the loopholes enabling the Kremlin to refill its war chest.“Ukrainians who came to the UK to seek safety and still cannot return to their war-torn homes must be given ongoing protection and proper support.“The UK must keep supporting Ukraine to defend itself, and Prime Minister Keir Starmer must make it crystal clear when he meets President Trump that we will do so.“The end goal is a just and lasting peace based on the sovereignty, independence and territorial integrity of Ukraine. That can still be achieved.”Promoted by Chris Williams on behalf of The Green Party, both at PO Box 78066, London, SE16 9GQ",https://greenparty.org.uk/2025/02/22/standing-in-solidarity-with-ukraine/,Green Party,UK,2025,467
Discarding old friends for new autocrats,2025-02-14,"14 February 2025 / 25 February 2025 by Green PartyGreen Party response to JD Vance speech (1)Green MP, and party parliamentary spokesperson on foreign affairs, Ellie Chowns said: “US Vice President JD Vance’s use of the Munich Security Conference to lambast allies rather than focus on the real chaos makers in the world is sadly predictable but no less bizarre and dangerous for that.“President Trump’s administration seems determined to usher in a new world where old friends are discarded and new friends made of dangerous autocrats. The UK should have no part of that and should work with others to protect international frameworks and institutions that support co-operation and the rule of law.”(1) https://www.politico.eu/article/us-vice-president-jd-vance-attack-europe-migration-free-speech/Promoted by Chris Williams on behalf of The Green Party, both at PO Box 78066, London, SE16 9GQ",https://greenparty.org.uk/2025/02/14/discarding-old-friends-for-new-autocrats/,Green Party,UK,2025,467
Labour are “plumbing new depths” with filmed immigration raids,2025-02-10,"10 February 2025 / 26 February 2025 by Green PartyResponding to the news that Labour are now publishing videos of police immigration raids, Green Party Co-Leader, Carla Denyer MP, said:“This Labour government are plumbing new depths with their plan to broadcast footage of people being detained and deported. Those involved should be searching their consciences to ask if such breath-taking cruelty is really worth it all for the sake of aping the rhetoric of Reform. The bitter irony is that following Reform to the right on migration won’t win Labour any support – it will only lend legitimacy to Reform’s extreme views. It’s time this government showed a bit of backbone and told the truth – that migration is good for this country.”TaggedPromoted by Chris Williams on behalf of The Green Party, both at PO Box 78066, London, SE16 9GQ",https://greenparty.org.uk/2025/02/10/labour-are-plumbing-new-depths-with-filmed-migration-raids/,Green Party,UK,2025,467
Greens call for Drax subsidies to be shifted to home insulation scheme,2025-02-07,"7 February 2025 by Paul CorryGreen MP and party co-leader Adrian Ramsay has urged the government to divert planned new subsidies for the privately owned wood-burning Drax power station to a national home insulation scheme.Adrian Ramsay said:“Drax is a green energy scam, burning trees – some imported from ancient forests from as far away as Canada – subsidised by the taxpayer.“The billions of pounds worth of subsidies run out in 2027, but the government is expected to try to renew them next week, turning taxpayer money into profits for a private company, instead of using the money to fuel a green energy revolution.“Drax has benefitted from over £6 billion in subsidies since 2012 and neither taxpayers nor the environment can afford a penny more.“The money should be used to help fund a national scheme of home insulation that would cut people’s energy bills and help to reduce energy use.“Green MPs and Peers will be pressing the government to end this subsidy scandal and invest people’s money where it will make a real difference to them.”Promoted by Chris Williams on behalf of The Green Party, both at PO Box 78066, London, SE16 9GQ",https://greenparty.org.uk/2025/02/07/greens-call-for-drax-subsidies-to-be-shifted-to-home-insulation-scheme/,Green Party,UK,2025,467
Greens warn of burning world and call for faster government-backed transition,2025-02-06,"6 February 2025 by Paul CorryResponding to new data from the Copernicus Climate Change Service (1) showing that the global temperature was the highest on record for a January, Green Party co-leader Carla Denyer MP said:“In light of this latest scientific evidence, it would be dangerously foolish to do anything to put our burning world in even greater danger.“Yet that is exactly what the government is doing – determined to expand Heathrow and Gatwick airports and refusing to rule out giant new oil and gas fields at Rosebank and Jackdaw coming on stream.“Indeed, Equinor, one of the oil giants wanting to exploit the Rosebank field, has decided to cut promised investments in renewables in favour of increased oil and gas production. (2)“The government is sending totally the wrong signals to the markets. We need a government committed to speeding up the transition away from fossil fuels. The government must make it clear now that it will not allow new North Sea oil and gas drilling go ahead.“We must also get serious about how we make our communities more resilient to the now-unavoidable impacts of climate change. We need our homes and our communities to be fit for the future.”NOTES TO EDITORSPromoted by Chris Williams on behalf of The Green Party, both at PO Box 78066, London, SE16 9GQ",https://greenparty.org.uk/2025/02/06/greens-warn-of-burning-world-and-call-for-faster-government-backed-transition/,Green Party,UK,2025,467
This announcement is straight out of an authoritarian playbook.,2025-02-05,"5 February 2025 / 26 February 2025 by Green PartyGreen Party Co-Leader Adrian Ramsay MP has responded to the news that local elections in a number of parts of England this May will cancelled saying: “It’s hard to think of anything more anti-democratic than cancelling elections ahead of a significant change in local democracy. It’s straight out of an authoritarian playbook.“How can the Government claim an electoral mandate for these major changes if those most impacted see their elections cancelled?“The Green Party is urging the Government to protect democracy, allow these long-planned elections to take place and get around the table with elected representatives of all parties to discuss how to make devolution work for people in local areas across the country.“We want decisions closest to where they have the greatest impact with significant devolution of powers and funding from Westminster. That is the way to keep the vital connection between the politicians making decisions and those affected by them and avoid further alienation from the political process. The imposition of huge, remote councils against the will of local people would fly in the face of local democracy.”TaggedPromoted by Chris Williams on behalf of The Green Party, both at PO Box 78066, London, SE16 9GQ",https://greenparty.org.uk/2025/02/05/this-announcement-is-straight-out-of-an-authoritarian-playbook/,Green Party,UK,2025,467
The forced movement of a people from their homeland is ethnic cleansing say Greens,2025-02-05,"5 February 2025 / 26 February 2025 by Green PartyResponding to President Trump’s remarks overnight, Green Party MP, Ellie Chowns, said,

“The forced movement of a people from their homeland is ethnic cleansing. These comments advocating for ethnic cleansing have to be understood in the context of the mounting evidence of genocide in Gaza occurring over the last year. The people of Gaza are not obstacles to be removed; they are human beings with the right to live with dignity, security, and self-determination. Britain, and our international allies must today respond in the strongest terms condemning Trump’s reckless remarks.”She continued, “Britain must take the opportunity today to reiterate the Palestinian right to self-determination. And if we are serious about this, we should clearly state our support for Palestinian statehood. This is the bare minimum that is required at this stage.”

“Strategically now it is essential that none of these words fan the flames of conflict and jeopardise the precious ceasefire that is currently in place. The United States has an absolute legal obligation to follow international law, but it also has a moral obligation to ensure it works towards supporting the ongoing respect of the ceasefire.”TaggedPromoted by Chris Williams on behalf of The Green Party, both at PO Box 78066, London, SE16 9GQ",https://greenparty.org.uk/2025/02/05/the-forced-movement-of-a-people-from-their-homeland-is-ethnic-cleansing-say-greens/,Green Party,UK,2025,467
Strong bonds with European neighbours is the only tonic to toxic Trump,2025-02-03,"3 February 2025 / 26 February 2025 by Green PartyIn response to Starmer joining the EU 27 this evening, Greens are urging him to put European unity at the top of his agenda to provide a united front against the toxic impact of Trump’s trade wars.

Commenting, Green Party Co-Leader, Adrian Ramsay MP, said:“Tonight represents a historic opportunity for the UK. Starmer will be the first PM to attend an EU summit since we left the European Union.

“In the face of increasing international hostility from President Trump, the UK needs to be clear that we stand united in the face of his aggression.

“Starmer cannot do that by parroting Trump’s talking points on defence spending.

“Strong bonds with our European neighbours are the only antidote available to this toxic Trump Presidency.“In the short-term, Starmer should embrace the idea of young people being able to move freely across their continent to work travel and study and respond positively to the EU’s offer of a youth mobility scheme”He continued:“Brexit has resulted in tens of billions of pounds draining from our economy.

“The Office for Budget Responsibility estimates that Brexit will deliver a 15% long-term hit to UK trade.

“We should, as a matter of urgency, be looking to rejoin the Customs Union as a first step to plugging this hole.

“And the PEM deal the EU has offered is a no brainer.“If Starmer is serious about taking tough decisions for economic stability then this would be a good starting point, not pumping money into climate-rocketing projects like Heathrow expansion.”

ENDTaggedPromoted by Chris Williams on behalf of The Green Party, both at PO Box 78066, London, SE16 9GQ",https://greenparty.org.uk/2025/02/03/strong-bonds-with-european-neighbours-is-the-only-tonic-to-toxic-trump/,Green Party,UK,2025,467
We must scrap Ofsted say Greens,2025-02-03,"3 February 2025 / 26 February 2025 by Green PartyResponding to the news that Ofsted is considering a new approach to inspecting education providers and introducing ‘report cards’ for schools, Green Party Education Spokesperson, Vix Lowthion, said:

“Ofsted isn’t working. For teachers or parents. We’ve seen the toxic impact it can have on teachers and we know it doesn’t serve children. These reforms are too close to the previous failed model. We must instead scrap Ofsted and end the era of forcing teachers into narrowly defined boxes. To replace it we need a collaborative model connecting teachers on the frontline with local experts. By connecting them with specialists in pedagogy, child development and social care we can encourage teacher retention, tailor support to local circumstances and drive much better local and national outcomes.”TaggedPromoted by Chris Williams on behalf of The Green Party, both at PO Box 78066, London, SE16 9GQ",https://greenparty.org.uk/2025/02/03/we-must-scrap-ofsted-say-greens/,Green Party,UK,2025,467
